company,id,title,location,url,notes
github,2657,Senior Engineering Manager,US Remote,https://careers-githubinc.icims.com/jobs/2657/login,"About GitHub As the global home for all developers, GitHub is the complete AI-powered developer platform to build, scale, and deliver secure software. Over 100 million people, including developers from 90 of the Fortune 100 companies, use GitHub to build amazing things together across 330+ million repositories. With all the collaborative features of GitHub, it has never been easier for individuals and teams to write faster, better code. Locations In this role you can work from Remote, United States Overview GitHub is changing the way the world builds software, and we want you to help build GitHub. We're looking for an experienced software engineering manager to join a passionate, collaborative, distributed group of engineers on our team. The GitHub Mobile team is changing the way that developers across the world collaborate on GitHub through native Android and iOS apps. Launched in March 2020, GitHub Mobile is one of our fastest growing products. The mobile team is part of the Client Apps organization, working alongside the GitHub Desktop and GitHub CLI teams. This role will oversee one of our GitHub Mobile squads with Android, iOS, and server engineers located across the United States. You will partner closely with our other GitHub Mobile squad located primarily in Berlin, Germany. Stack: Our apps are built natively with Kotlin for Android and Swift for iOS. Our apps communicate with GitHub via GraphQL and REST APIs. A day in the life of a Senior Engineering Manager: Our team is distributed worldwide which means we work asynchronously most of the time. Your typical week would include: Work with design, data, and product management to understand the problems we want to solve, then working with engineers to solve them. Solving engineering and product problems with engineering collaborators via GitHub, Slack, and Zoom Planning with partner teams and stakeholders Create and foster a high-performance culture amongst your team Conducting 1:1s with direct reports to provide regular feedback and ensure career growth and progression Working with your manager in your 1:1 meetings to grow yourself and career Talking with users to get feedback and data about the apps Responsibilities Responsibilities: Cultivate an environment where team members are empowered and demonstrate a strong sense of ownership Meet with team members 1:1 on a regular basis Help the team ships products, features, and bug-fixes regularly Ensure that individuals on the team are learning, growing, and advancing in their careers Effectively communicate directions and decisions with the team and company Build alignment with engineering, design, and product leadership Guide the team toward building high quality software across multiple platforms Qualifications Required Qualifications: 6+ years of experience designing, developing, and shipping high-quality software at scale 2+ years of experience in people management or relevant experience in leading technical teams Experience developing a strategy and roadmap for your teams Preferred Qualifications: There are only a handful of folks who meet all qualifications. Is this you? Excellent, please apply. But we care most about managers that have a track record of caring deeply about their teams, management as a craft, and shipping software that helps people with their work. Either way, we want to hear from you. Experience with Android and/or iOS Experience with Ruby on Rails Knowledge of testing, profiling, and debugging practices Experience working asynchronously on a remote, distributed team Passionate about fostering good engineering practices and processes Experience communicating with high-level stakeholders and executing large initiatives in an iterative fashion Compensation Range USD $104,400.00 - USD $276,900.00 /Yr. In addition, certain roles also have the opportunity to earn sales incentives based on revenue or utilization, depending on the terms of the plan and the employee's role. These pay ranges are intended to cover roles based across the United States. An individual's base pay depends on various factors including geographical location and review of experience, knowledge, skills, abilities of the applicant. At GitHub certain roles are eligible for benefits and additional rewards, including annual bonus and stock. These rewards are allocated based on individual impact in role. In addition, certain roles also have the opportunity to earn sales incentives based on revenue or utilization, depending on the terms of the plan and the employee's role. GitHub values Customer-obsessed Ship to learn Growth mindset Own the outcome Better together Diverse and inclusive Manager fundamentals Model Coach Care Leadership principles Create clarity Generate energy Deliver success Who We Are GitHub is the world’s leading AI-powered developer platform with 100 million developers and counting. We’re also home to the biggest open-source community on earth (and 99% of the world’s software has open-source code in its DNA). Many of the apps and programs you use every day are built on GitHub. Our teams are dreamers, doers, and pioneers, leading the way in AI, driving humanitarian efforts around the globe, and even sending open source to Mars (and beyond!). At GitHub, our goal is to create the space you need to do your best work. We’re remote-first and offer competitive pay, generous learning and growth opportunities, and excellent benefits to support you, wherever you are—because we know that people flourish when they can work on their own terms. Join us, and let’s change the world, together. EEO Statement GitHub is made up of people from a wide variety of backgrounds and lifestyles. We embrace diversity and invite applications from people of all walks of life. We don't discriminate against employees or applicants based on gender identity or expression, sexual orientation, race, religion, age, national origin, citizenship, disability, pregnancy status, veteran status, or any other differences. Also, if you have a disability, please let us know if there's any way we can make the interview process better for you; we're happy to accommodate!"
github,2658,Staff Engineering Manager,Germany Remote,https://globalcareers-githubinc.icims.com/jobs/2658/login,"About GitHub As the global home for all developers, GitHub is the complete AI-powered developer platform to build, scale, and deliver secure software. Over 100 million people, including developers from 90 of the Fortune 100 companies, use GitHub to build amazing things together across 330+ million repositories. With all the collaborative features of GitHub, it has never been easier for individuals and teams to write faster, better code. Locations In this role you can work from Remote, Germany Overview GitHub Issues are the foundation for planning & tracking work on GitHub. This role is an Staff Engineering Manager on the Issues team, specifically leading the team responsible for the Issues Platform with a focus on availability, performance and evolving the architecture. As a leader and manager, you will directly influence engineering culture, mentor and grow other engineers, engage in long term architectural planning, and partner closely with key partners across the company to help deliver a highly available and scalable planning & tracking experience. While your direct team is located in Europe, you will join a fully distributed org - you will thrive in an environment of asynchronous communication. We expect you to have the ability to communicate complex technical concepts, and be able to create working relationships with coworkers in locations around the globe. Responsibilities Clear and effective communication skills, be it when you write code, send emails, or explain complex technical issues to non-technical co-workers. A desire to take up new challenges and lead a group of highly skilled, dedicated and smart engineers. You're always looking for ways we can be better as a team. Reliable and responsible work ethic. You enjoy taking on responsibility within your role, on projects you have initiated, and you also enjoy bringing out the best in your teammates. Drive to provide clarity and a shared understanding of decision making, direction, and progress for the team and the company. Qualifications Required Qualifications: Several years experience building and shipping software using a variety of technology stacks, or equivalent experience. Experience leading teams as people manager or technical leader Experience working with a distributed team Experience developing a strategy and roadmap for your teams Preferred Qualifications: Passionate about fostering good engineering practices and processes Have previous experience building and maintaining highly available and scalable services. Have significant experience with one or more backend technologies: server-side environments, compute, datastores, networking, infrastructure, devops, security, and programming languages. Have significant experience with open-source software, communities, and the systems these communities use to self-organize and ship software for others. GitHub values Customer-obsessed Ship to learn Growth mindset Own the outcome Better together Diverse and inclusive Manager fundamentals Model Coach Care Leadership principles Create clarity Generate energy Deliver success Who We Are GitHub is the world’s leading AI-powered developer platform with 100 million developers and counting. We’re also home to the biggest open-source community on earth (and 99% of the world’s software has open-source code in its DNA). Many of the apps and programs you use every day are built on GitHub. Our teams are dreamers, doers, and pioneers, leading the way in AI, driving humanitarian efforts around the globe, and even sending open source to Mars (and beyond!). At GitHub, our goal is to create the space you need to do your best work. We’re remote-first and offer competitive pay, generous learning and growth opportunities, and excellent benefits to support you, wherever you are—because we know that people flourish when they can work on their own terms. Join us, and let’s change the world, together."
github,2701,Staff Technical Business Operations Manager,US Remote,https://careers-githubinc.icims.com/jobs/2701/login,"About GitHub As the global home for all developers, GitHub is the complete AI-powered developer platform to build, scale, and deliver secure software. Over 100 million people, including developers from 90 of the Fortune 100 companies, use GitHub to build amazing things together across 330+ million repositories. With all the collaborative features of GitHub, it has never been easier for individuals and teams to write faster, better code. Locations In this role you can work from Remote, United States Overview Are you a business technologist who thrives on solving complex problems, improving organizational effectiveness, and leading through influence? Do you have a passion for GitHub, open source, and developer communities? Do you want to work closely with a senior engineering leader and help shape the future of GitHub Engineering? If so, you might be the Technical Business Operations Manager (TBOM) we are looking for. As a TBOM, you will be supporting one of our Engineering Leadership Team (Eng. LT) members, managing their office, portfolio, and strategic initiatives. You will also be a boundaryless collaborator, a connector of dots, and an organizational ""air traffic controller"", working across teams and functions to ensure alignment, execution, and communication. You will be a trusted advisor and confidant to the Eng. LT member, providing data-driven insights, candid feedback, and proactive support. You will also be a relationship and brand manager, building and maintaining a positive reputation for the Eng. LT member, their department, and yourself as a TBOM. To succeed in this role, you will need to have a deep understanding of both the business and the technology, as well as the ability to learn quickly, adapt to change, and operate with ambiguity. You will need to have excellent communication, coordination, and facilitation skills, as well as a strong sense of ownership, accountability, and urgency. You will need to have a growth mindset, an engineering mindset, and a customer-centric mindset. You will need to have a high degree of emotional intelligence, empathy, and integrity. You will need to have a love for GitHub, its culture, values, and mission. Responsibilities Manage the office of the Eng. LT member, including establishing, documenting, and maturing repeatable processes for critical business functions, partnering with other teams to ensure smooth operations, and preparing and delivering internal and external communications Improve department effectiveness, including serving as a gatekeeper, a pinch hitter, and a general solver of problems, improving the effectiveness of the Eng. LT member, their direct reports, and the business as a whole, and overseeing the implementation of technical or non-technical improvements Engage boundarylessly, including owning ""somebody should own this""-type projects, resolving disputes, driving consensus, and facilitating tough conversations, regardless of organizational boundaries or corporate hierarchy Manage the Eng. LT member's portfolio, including communicating, coordinating, and facilitating work in flight, especially strategic or cross-functional initiatives, reporting up and across on progress and status, and identifying, analyzing, and mitigating risks Support strategy, planning, culture, and values, including shaping the department's vision, plans, OKRs, and other strategy documents, communicating and cascading the core strategic tenants to stakeholders, and establishing, shaping, debugging, and socializing department culture, values, and health Advise and confide, including understanding the on-the-ground pulse of the department, deeply understanding issues, trends, and perspectives, and delivering persuasive recommendations, and serving as a proxy and representative for the Eng. LT member Manage relationships and brands, including furthering a ""get stuff done"" reputation, leading through persuasion and influence, and being a thoughtful and kind human leader Qualifications Required Qualifications 5+ years of experience in a technical, business, or operational role, preferably in a software or internet company Bachelor's degree in engineering, computer science, business, or a related field, or equivalent practical experience Willingness to travel up to 20% of the time. Preferred Qualifications Demonstrated ability to learn new technologies, domains, and systems quickly and effectively Demonstrated ability to work with senior leaders, cross-functional teams, and external partners, and to influence and align stakeholders without formal authority Demonstrated ability to manage multiple projects, priorities, and deadlines in a fast-paced and dynamic environment Demonstrated ability to communicate clearly, concisely, and persuasively, both verbally and in writing, to different audiences and levels Demonstrated ability to analyze data, synthesize information, and provide actionable insights and recommendations Demonstrated ability to operate with a high degree of autonomy, ownership, accountability, and urgency Demonstrated ability to embody and foster a growth mindset, an engineering mindset, and a customer-centric mindset Demonstrated ability to practice and promote honesty, integrity, decency, fairness, and authenticity Demonstrated passion for GitHub, open source, and developer communities Compensation Range USD $118,100.00 - USD $313,300.00 /Yr. In addition, certain roles also have the opportunity to earn sales incentives based on revenue or utilization, depending on the terms of the plan and the employee's role. These pay ranges are intended to cover roles based across the United States. An individual's base pay depends on various factors including geographical location and review of experience, knowledge, skills, abilities of the applicant. At GitHub certain roles are eligible for benefits and additional rewards, including annual bonus and stock. These rewards are allocated based on individual impact in role. In addition, certain roles also have the opportunity to earn sales incentives based on revenue or utilization, depending on the terms of the plan and the employee's role. GitHub values Customer-obsessed Ship to learn Growth mindset Own the outcome Better together Diverse and inclusive Manager fundamentals Model Coach Care Leadership principles Create clarity Generate energy Deliver success Who We Are GitHub is the world’s leading AI-powered developer platform with 100 million developers and counting. We’re also home to the biggest open-source community on earth (and 99% of the world’s software has open-source code in its DNA). Many of the apps and programs you use every day are built on GitHub. Our teams are dreamers, doers, and pioneers, leading the way in AI, driving humanitarian efforts around the globe, and even sending open source to Mars (and beyond!). At GitHub, our goal is to create the space you need to do your best work. We’re remote-first and offer competitive pay, generous learning and growth opportunities, and excellent benefits to support you, wherever you are—because we know that people flourish when they can work on their own terms. Join us, and let’s change the world, together. EEO Statement GitHub is made up of people from a wide variety of backgrounds and lifestyles. We embrace diversity and invite applications from people of all walks of life. We don't discriminate against employees or applicants based on gender identity or expression, sexual orientation, race, religion, age, national origin, citizenship, disability, pregnancy status, veteran status, or any other differences. Also, if you have a disability, please let us know if there's any way we can make the interview process better for you; we're happy to accommodate!"
github,2704,Senior Applied Researcher,US Remote,https://careers-githubinc.icims.com/jobs/2704/login,"About GitHub As the global home for all developers, GitHub is the complete AI-powered developer platform to build, scale, and deliver secure software. Over 100 million people, including developers from 90 of the Fortune 100 companies, use GitHub to build amazing things together across 330+ million repositories. With all the collaborative features of GitHub, it has never been easier for individuals and teams to write faster, better code. Locations In this role you can work from Remote, United States Overview GitHub Copilot has changed the way software is built, and we have a unique opportunity to look further ahead to identify how software development can be faster, safer, easier, and more accessible. We’re looking for talented and passionate applied scientists to join us in this mission! Our team, GitHub Copilot Applied Science, has a crucial role in advancing the core intelligence solutions within Copilot. Our responsibilities encompass various areas such as LLM fine-tuning generation, prompt engineering, and the development of end-to-end AI features using cutting-edge technologies. In this role, you will collaborate closely with a diverse and highly skilled group of researchers, scientists, and software engineers within our team, while partnering with multiple teams across Github and Microsoft. Together, we are dedicated to shaping the future of software development by continuously enhancing AI-powered capabilities in Copilot. Responsibilities Drive research initiatives for online metrics development to continuously assess and improve the real-time performance of Copilot products Develop and implement methodologies for offline quality measurement, ensuring robust evaluation of large language model outputs in diverse scenarios. Lead the development of tools for automating quality analysis, streamlining the assessment process, and enhancing the efficiency of large-scale model evaluations. Integrate Responsible AI principles into the development lifecycle of Copilot products. Design and execute experiments to evaluate the impact of model changes, ensuring continuous refinement and advancement. Hands-on engagement with model training activities to elevate the performance of the Copilot product. Qualifications Required Qualifications Bachelor's Degree in Statistics, Econometrics, Computer Science, Electrical or Computer Engineering, or related field AND 2+ years related experience (e.g., statistics, predictive analytics, research) OR Master's Degree in Statistics, Econometrics, Computer Science, Electrical or Computer Engineering, or related field AND 1+ year(s) related experience (e.g., statistics, predictive analytics, research) OR Doctorate in Statistics, Econometrics, Computer Science, Electrical or Computer Engineering, or related field OR equivalent experience 5+ years experience in applied science, machine learning, deep learning, natural language processing or large-scale data mining. Strong programming skills in languages such as Python, and experience with relevant libraries and framework Preferred Qualifications: These are more specific abilities we’re looking for . Think of this as a descriptive sketch, not a checklist of requirements. Be comfortable applying even if you don’t have all of them. Ph.D in computer science, machine learning, or a related field. Experience working with LLM and OpenAI models. Understanding of Responsible AI principles and their application in AI product development. Have significant experience with large-scale data analysis and experimentation Expertise in developing tools for automation and familiarity with quality analysis frameworks. Excellent analytical and problem-solving skills with a keen attention to detail Excellent written and verbal communication skills Compensation Range USD $104,400.00 - USD $276,900.00 /Yr. In addition, certain roles also have the opportunity to earn sales incentives based on revenue or utilization, depending on the terms of the plan and the employee's role. These pay ranges are intended to cover roles based across the United States. An individual's base pay depends on various factors including geographical location and review of experience, knowledge, skills, abilities of the applicant. At GitHub certain roles are eligible for benefits and additional rewards, including annual bonus and stock. These rewards are allocated based on individual impact in role. In addition, certain roles also have the opportunity to earn sales incentives based on revenue or utilization, depending on the terms of the plan and the employee's role. GitHub values Customer-obsessed Ship to learn Growth mindset Own the outcome Better together Diverse and inclusive Manager fundamentals Model Coach Care Leadership principles Create clarity Generate energy Deliver success Who We Are GitHub is the world’s leading AI-powered developer platform with 100 million developers and counting. We’re also home to the biggest open-source community on earth (and 99% of the world’s software has open-source code in its DNA). Many of the apps and programs you use every day are built on GitHub. Our teams are dreamers, doers, and pioneers, leading the way in AI, driving humanitarian efforts around the globe, and even sending open source to Mars (and beyond!). At GitHub, our goal is to create the space you need to do your best work. We’re remote-first and offer competitive pay, generous learning and growth opportunities, and excellent benefits to support you, wherever you are—because we know that people flourish when they can work on their own terms. Join us, and let’s change the world, together. EEO Statement GitHub is made up of people from a wide variety of backgrounds and lifestyles. We embrace diversity and invite applications from people of all walks of life. We don't discriminate against employees or applicants based on gender identity or expression, sexual orientation, race, religion, age, national origin, citizenship, disability, pregnancy status, veteran status, or any other differences. Also, if you have a disability, please let us know if there's any way we can make the interview process better for you; we're happy to accommodate!"
