company,id,title,location,url,notes
github,4409,"Software Engineer III, Runtime Platform",US Remote,https://careers-githubinc.icims.com/jobs/4409/login,"About GitHub As the global home for all developers, GitHub is the complete AI-powered developer platform to build, scale, and deliver secure software. Over 150+ million developers, including more than 90% of the Fortune 100 companies, use GitHub to collaborate and experiment across 420+ million repositories. With all the collaborative features of GitHub, it has never been easier for individuals and teams to write faster, better code. Locations In this role you can work from Remote, United States Overview GitHub is changing the way the world builds software, and we want you to help. At GitHub, we constantly strive to create an environment that allows our employees to do the best work of their lives. GitHub is looking for a talented Software Engineer III to join our Platform Team in the Development Experience department. Our team is working on multiple products all aimed to enable GitHub’s engineers to deliver value in a faster and secure way. We work on the entire delivery stack from chatops infra to PR linting and up to the actual deployments of Github’s services both to kubernetes and virtual machine environments. On this team, you’ll collaborate across functions and across teams to deliver the best possible developer experience for all engineers here at GitHub. In this role, you will be having the opportunity to work as an engineer with a globally distributed, diverse and passionate team where you will be expected to demonstrate independence and a drive to deliver. You will design, implement, rollout and support a highly performant, highly scalable and highly available host of services alongside a team of fellow software engineering professionals. This team and its parent Development Experience department are highly distributed across the globe and span a variety of diverse backgrounds. We recognize the value this diversity brings to our teams and our products, so creating and maintaining an environment where every individual feels safe to bring their unique perspective to the challenges we're solving is important to us. Responsibilities Demonstrate a strong commitment to high quality software development practices Actively design, develop, document and maintain our deployment infrastructure services with a product mindset Provide compassionate technical mentorship, pairing opportunities, and code reviews to encourage professional and technical growth of those around you Build tools and systems that empathetically and pragmatically meet real operability needs of GitHub developers Develop and maintain scalable infrastructure Use data to understand the availability, reliability, and sustainability of our infrastructure Work closely with other teams from around the organization Own and advocate for the health and quality of the systems that the team builds, including participating in on-call rotations and responding to incidents as necessary Qualifications Required Qualifications: 4+ years experience in Software Engineering, Computer Science, or related technical discipline with proven experience maintaining and delivering production software languages including, but not limited to, C, C++, C#, JavaScript, Go, Ruby, Rust, or Python OR Associate’s Degree in Computer Science, Electrical Engineering, Electronics Engineering, Math, Physics, Computer Engineering, Computer Science, or related field AND 3+ years experience OR Bachelor's Degree in Computer Science, Electrical Engineering, Electronics Engineering, Math, Physics, Computer Engineering, Computer Science, or related field AND 2+ years experience in Computer Science, or related technical discipline with proven experience coding in languages including, but not limited to, C, C++, C#, JavaScript, Go, Ruby, Rust, or Python OR Master's Degree in Computer Science, Electrical Engineering, Electronics Engineering, Math, Physics, Computer Engineering, Computer Science, or related field OR equivalent experience 2+ years experience with running, operating, and maintaining production systems 2+ years experience designing, building and running large scale and highly available cloud services or distributed systems Preferred Qualifications: Solid understanding of testing principles and high quality software Experience with Kubernetes or other container orchestration systems Experience building infrastructure automation Experience working with the Linux operating system Experience running, monitoring and troubleshooting issues in a production always-on service Excellent analytical skills and communication skills. Fluent in English both verbal and written. We are a global cross-countries team so we’re extra mindful about communication. Compensation Range The base salary range for this job is USD $97,900.00 - USD $259,900.00 /Yr. These pay ranges are intended to cover roles based across the United States. An individual's base pay depends on various factors including geographical location and review of experience, knowledge, skills, abilities of the applicant. At GitHub certain roles are eligible for benefits and additional rewards, including annual bonus and stock. These rewards are allocated based on individual impact in role. In addition, certain roles also have the opportunity to earn sales incentives based on revenue or utilization, depending on the terms of the plan and the employee's role. GitHub values Customer-obsessed Ship to learn Growth mindset Own the outcome Better together Diverse and inclusive Manager fundamentals Model Coach Care Leadership principles Create clarity Generate energy Deliver success Who We Are GitHub is the world’s leading AI-powered developer platform with 150 million developers and counting. We’re also home to the biggest open-source community on earth (and 99% of the world’s software has open-source code in its DNA). Many of the apps and programs you use every day are built on GitHub. Our teams are dreamers, doers, and pioneers, leading the way in AI, driving humanitarian efforts around the globe, and even sending open source to Mars (and beyond!). At GitHub, our goal is to create the space you need to do your best work. We’re remote-first and offer competitive pay, generous learning and growth opportunities, and excellent benefits to support you, wherever you are—because we know that people flourish when they can work on their own terms. Join us, and let’s change the world, together. EEO Statement GitHub is made up of people from a wide variety of backgrounds and lifestyles. We embrace diversity and invite applications from people of all walks of life. We don't discriminate against employees or applicants based on gender identity or expression, sexual orientation, race, religion, age, national origin, citizenship, disability, pregnancy status, veteran status, or any other differences. Also, if you have a disability, please let us know if there's any way we can make the interview process better for you; we're happy to accommodate!"
github,4417,"Staff Software Engineer, Compute Platform",US Remote,https://careers-githubinc.icims.com/jobs/4417/login,"About GitHub As the global home for all developers, GitHub is the complete AI-powered developer platform to build, scale, and deliver secure software. Over 150+ million developers, including more than 90% of the Fortune 100 companies, use GitHub to collaborate and experiment across 420+ million repositories. With all the collaborative features of GitHub, it has never been easier for individuals and teams to write faster, better code. Locations In this role you can work from Remote, United States | Remote, United States Overview GitHub is looking for a Staff Software Engineer to join the Compute Platform team within our Developer Experience organization. You will focus on the systems and tools that enable our engineers to operate and scale the world's largest code hosting platform. You will plan, deploy, and maintain our Kubernetes clusters with a focus on making the Developer Experience the best it can be for our engineering and infrastructure teams. The Developer Experience team is highly distributed and you will thrive in an environment of remote work and asynchronous communication. You're expected to have strong written communication skills and be able to develop working relationships with coworkers in locations around the globe. As an engineer at GitHub you'll always be challenged to solve interesting and novel problems that have real impact on how the world builds software. Responsibilities Build and improve the frameworks and tools we use to build, test, configure our Kubernetes clusters. Ensure a reliable Kubernetes platform across bare-metal, virtual machines, and cloud environments. Cultivate open source projects developed by GitHub and build things you are proud to share. Work closely with other engineering and infrastructure teams to design solutions and support Kubernetes workloads. Qualifications Required Qualifications: 9+ years experience in Software Engineering, Computer Science, or related technical discipline with proven experience maintaining and delivering production software coding in languages including, but not limited to, C, C++, C#, Java, JavaScript, Go, Ruby, Rust, or Python OR Associate’s Degree in Computer Science, Electrical Engineering, Electronics Engineering, Math, Physics, Computer Engineering, Computer Science, or related field AND 8+ years experience in Software Engineering, Computer Science, or related technical discipline with proven experience maintaining and delivering production software coding in languages including, but not limited to, C, C++, C#, Java, JavaScript, Go, Ruby, Rust, or Python OR Bachelor's Degree in Computer Science or related field AND 7+ years experience in Software Engineering, Computer Science, or related technical discipline with proven experience maintaining and delivering production software coding in languages including, but not limited to, C, C++, C#, Java, JavaScript, Go, Ruby, Rust, or Python OR Master's Degree in Computer Science, Electrical Engineering, Electronics Engineering, Math, Physics, Computer Engineering, Computer Science, or related field AND 5+ years experience in Software Engineering, Computer Science, or related technical discipline with proven experience maintaining and delivering production software coding in languages including, but not limited to, C, C++, C#, Java, JavaScript, Go, Ruby, Rust, or Python. OR Doctorate in Computer Science, Electrical Engineering, Electronics Engineering, Math, Physics, Computer Engineering, Computer Science, or related field AND 3+ years experience in Software Engineering, Computer Science, or related technical discipline with proven experience maintaining and delivering production software coding in languages including, but not limited to, C, C++, C#, Java, JavaScript, Go, Ruby, Rust, or Python. OR equivalent experience. 2+ years technical leadership experience. 9+ years of technical engineering experience in infrastructure domains 4+ years of experience with Kubernetes platform architecture, primitives, and experience with AWS or Azure cloud environments Preferred Qualifications: Experience operating Kubernetes in a high scale, production environment. Specific experience in managing/configuring AKS or EKS environments highly preferred. Competent in one or more scripting languages (e.g., Bash, Python, or a similar language). Knowledge of Hashicorp’s Terraform, Consul, and Vault products Experience with virtualization, bare metal deployment, or network engineering Experience with diagnosing and automating large, complex distributed systems with an eye toward reliability Compensation Range The base salary range for this job is USD $127,600.00 - USD $338,500.00 /Yr. These pay ranges are intended to cover roles based across the United States. An individual's base pay depends on various factors including geographical location and review of experience, knowledge, skills, abilities of the applicant. At GitHub certain roles are eligible for benefits and additional rewards, including annual bonus and stock. These rewards are allocated based on individual impact in role. In addition, certain roles also have the opportunity to earn sales incentives based on revenue or utilization, depending on the terms of the plan and the employee's role. GitHub values Customer-obsessed Ship to learn Growth mindset Own the outcome Better together Diverse and inclusive Manager fundamentals Model Coach Care Leadership principles Create clarity Generate energy Deliver success Who We Are GitHub is the world’s leading AI-powered developer platform with 150 million developers and counting. We’re also home to the biggest open-source community on earth (and 99% of the world’s software has open-source code in its DNA). Many of the apps and programs you use every day are built on GitHub. Our teams are dreamers, doers, and pioneers, leading the way in AI, driving humanitarian efforts around the globe, and even sending open source to Mars (and beyond!). At GitHub, our goal is to create the space you need to do your best work. We’re remote-first and offer competitive pay, generous learning and growth opportunities, and excellent benefits to support you, wherever you are—because we know that people flourish when they can work on their own terms. Join us, and let’s change the world, together. EEO Statement GitHub is made up of people from a wide variety of backgrounds and lifestyles. We embrace diversity and invite applications from people of all walks of life. We don't discriminate against employees or applicants based on gender identity or expression, sexual orientation, race, religion, age, national origin, citizenship, disability, pregnancy status, veteran status, or any other differences. Also, if you have a disability, please let us know if there's any way we can make the interview process better for you; we're happy to accommodate!"
github,4425,Senior Software Engineer,US Remote,https://careers-githubinc.icims.com/jobs/4425/login,"About GitHub As the global home for all developers, GitHub is the complete AI-powered developer platform to build, scale, and deliver secure software. Over 150+ million developers, including more than 90% of the Fortune 100 companies, use GitHub to collaborate and experiment across 420+ million repositories. With all the collaborative features of GitHub, it has never been easier for individuals and teams to write faster, better code. Locations In this role you can work from Remote, United States Overview GitHub is growing its Engineering team and we're seeking experienced professionals to elevate our Physical Infrastructure efforts. As a Senior Software Engineer, you will design, build, and enhance physical infrastructure frameworks and tools, ensuring scalable and efficient data centers. The ideal candidate will be a key contributor to enhancing GitHub’s physical infrastructure, ensuring scalability and efficiency while gaining valuable experience in data center architecture, hardware innovation, and cross-functional collaboration to support developers globally. As an Infrastructure Engineer, you will report into GitHub's larger Platform organization. Platform is a distributed group that owns internal services, tools, and infrastructure used to build, deploy, and operate the services that make up GitHub. Built in our own data centers with a variety of open source software, our services are used by dozens of engineering teams across the company. We strive to act as a productivity multiplier by offering our customers the tools they need to deliver their services, allowing them to focus more on product. Responsibilities Design, build, and enhance physical infrastructure systems, frameworks, and tools to manage and maintain data centers, ensuring systems are scalable and efficient while automating processes to improve performance. Lead capacity planning and design initiatives, predict growth trends, and ensure infrastructure is properly scaled to handle increasing demands. Implement and maintain robust security measures, conduct vulnerability assessments, and ensure compliance with relevant regulatory standards, focusing on the unique requirements of physical infrastructure. Establish observability and monitoring systems to proactively identify and address performance gaps or outages and execute disaster recovery and failure test scenarios specific to physical infrastructure. Act as a senior point of contact for diagnosing and resolving infrastructure issues promptly to minimize downtime, contribute to incident management processes, and implement preventive measures to avoid future incidents. Collaborate with cross-functional teams, including software engineers and data center vendors, to troubleshoot issues, optimize infrastructure performance, and identify opportunities for new features and improvements in the space. Lead initiatives within the open-source community to enhance existing tools, develop new features, and share best practices, with a focus on physical infrastructure technologies. Lead the design and integration of physical hardware at the rack/chassis level, ensuring compatibility and efficiency in data center deployments Participate in an on-call rotation and quickly respond to issues and work to prevent them in the future Qualifications Required Qualifications: 6+ years’ technical experience in one or more infrastructure domains (e.g., container orchestration engineering, platform engineering, database engineering, software engineering, network engineering, systems administration, or related field), OR bachelor's degree in Computer Science, Information Technology, or related field AND 4+ years’ technical experience in infrastructure domains (e.g., container orchestration engineering, platform engineering, database engineering, software engineering, network engineering, systems administration, or related field), OR equivalent experience. 3+ years' experience with physical hardware design at the rack/chassis level in the context of datacenter deployments. 2+ years' experience deploying infrastructure in a data center. Preferred Qualifications: 1+ year(s) technical leadership experience 3+ years' experience in one or more scripting languages (e.g., Bash, Python, or a similar language) 3+ years' experience using general purpose programming languages (e.g., Go, Ruby, or a similar language) Extensive experience in designing and deploying physical infrastructure in data centers, and proficiency in scripting languages like Bash or Python Compensation Range The base salary range for this job is USD $112,800.00 - USD $299,300.00 /Yr. These pay ranges are intended to cover roles based across the United States. An individual's base pay depends on various factors including geographical location and review of experience, knowledge, skills, abilities of the applicant. At GitHub certain roles are eligible for benefits and additional rewards, including annual bonus and stock. These rewards are allocated based on individual impact in role. In addition, certain roles also have the opportunity to earn sales incentives based on revenue or utilization, depending on the terms of the plan and the employee's role. GitHub values Customer-obsessed Ship to learn Growth mindset Own the outcome Better together Diverse and inclusive Manager fundamentals Model Coach Care Leadership principles Create clarity Generate energy Deliver success Who We Are GitHub is the world’s leading AI-powered developer platform with 150 million developers and counting. We’re also home to the biggest open-source community on earth (and 99% of the world’s software has open-source code in its DNA). Many of the apps and programs you use every day are built on GitHub. Our teams are dreamers, doers, and pioneers, leading the way in AI, driving humanitarian efforts around the globe, and even sending open source to Mars (and beyond!). At GitHub, our goal is to create the space you need to do your best work. We’re remote-first and offer competitive pay, generous learning and growth opportunities, and excellent benefits to support you, wherever you are—because we know that people flourish when they can work on their own terms. Join us, and let’s change the world, together. EEO Statement GitHub is made up of people from a wide variety of backgrounds and lifestyles. We embrace diversity and invite applications from people of all walks of life. We don't discriminate against employees or applicants based on gender identity or expression, sexual orientation, race, religion, age, national origin, citizenship, disability, pregnancy status, veteran status, or any other differences. Also, if you have a disability, please let us know if there's any way we can make the interview process better for you; we're happy to accommodate!"
