company,id,title,location,url,notes
github,4317,"Staff Mgr, Software Engineering, Actions MacOS Platform",US Remote,https://careers-githubinc.icims.com/jobs/4317/login,"<strong>About GitHub</strong><br><br>As the global home for all developers, GitHub is the complete AI-powered developer platform to build, scale, and deliver secure software. Over 150+ million developers, including more than 90% of the Fortune 100 companies, use GitHub to collaborate and experiment across 420+ million repositories. With all the collaborative features of GitHub, it has never been easier for individuals and teams to write faster, better code.<br> <br><strong>Locations</strong><br><br>In this role you can work from Remote, United States<br> <br><strong>Overview</strong><br><br><p dir=""ltr"">GitHub is growing its Engineering team and seeks experienced professionals to elevate our software engineering efforts. As a Staff Manager of Software Engineering, you will lead teams in developing cost-effective, secure technical solutions and ensure system architecture aligns with business goals. The ideal candidate will drive strategic initiatives, enhance team collaboration, and gain insights into innovative engineering practices while shaping technology offerings within a dynamic and inclusive environment.</p><p><strong>&nbsp;</strong></p><p dir=""ltr"">Actions is a core part of GitHub and enables developers around the world. Millions of GitHub customers will rely on your team's work every single day. Actions Mac Cloud owns the end to end lifecycle of the fleet of machines that power all our hosted Mac runners for GitHub Actions. This includes:</p><ul><li dir=""ltr"" style=""list-style-type: disc;"" aria-level=""1""><p dir=""ltr"" role=""presentation"">Obtaining and provisioning hardware</p></li><li dir=""ltr"" style=""list-style-type: disc;"" aria-level=""1""><p dir=""ltr"" role=""presentation"">Working with data centers to deploy our hardware</p></li><li dir=""ltr"" style=""list-style-type: disc;"" aria-level=""1""><p dir=""ltr"" role=""presentation"">Building deployment and runtime software to provision and manage Mac hardware and virtual machines</p></li><li dir=""ltr"" style=""list-style-type: disc;"" aria-level=""1""><p dir=""ltr"" role=""presentation"">Interfacing with multiple vendors and engineering teams to accomplish the above</p></li></ul><p><strong>&nbsp;</strong></p><p dir=""ltr"">You&rsquo;ll be supporting engineers distributed across the United States working closely with the teams building Actions. You&rsquo;ll help set business and product direction, and you&rsquo;ll be involved in implementation, scaling, reliability and customer success to ensure we&rsquo;re setting our teams and customers up for success.&nbsp;</p><p><strong>&nbsp;</strong></p><p dir=""ltr"">The people on our teams believe that creating great products for GitHub users is a ton of fun, and you&rsquo;ll be inspired by the opportunity to help enable developers all over the world to build world-changing things with our tools.</p> <br><strong>Responsibilities</strong><br><br><ul><li dir=""ltr"" role=""presentation"">Partner with your team, other engineering teams, and product partners to enable the macOS runner capabilities needed by our customers.</li><li dir=""ltr"" style=""list-style-type: disc;"" aria-level=""1""><p dir=""ltr"" role=""presentation"">Lead the team to meet the service's high availability and scale requirements.</p></li><li dir=""ltr"" style=""list-style-type: disc;"" aria-level=""1""><p dir=""ltr"" role=""presentation"">Partner closely with Product and external stakeholders and vendors on planning, execution, and communication of long-term initiatives, delivering against our business objectives</p></li><li dir=""ltr"" style=""list-style-type: disc;"" aria-level=""1""><p dir=""ltr"" role=""presentation"">Hire, coach, and retain top engineering talent, fostering a culture of innovation and continuous learning.&nbsp;&nbsp;</p></li><li dir=""ltr"" style=""list-style-type: disc;"" aria-level=""1""><p dir=""ltr"" role=""presentation"">Lead and manage team performance, driving employee development and career growth through mentorship, knowledge sharing, and delegation of work.</p></li><li dir=""ltr"" style=""list-style-type: disc;"" aria-level=""1""><p dir=""ltr"" role=""presentation"">Think creatively while balancing technical constraints and customer needs to enable your team to build architecturally consistent, high quality software to reliably meet customer needs and exceed their expectations</p></li><li dir=""ltr"" style=""list-style-type: disc;"" aria-level=""1""><p dir=""ltr"" role=""presentation"">Own and advocate for the health and quality of the systems that the team builds, participate in a manager on-call rotation, and respond to incidents as necessary</p></li><li dir=""ltr"" style=""list-style-type: disc;"" aria-level=""1""><p dir=""ltr"" role=""presentation"">Drive data driven improvements to both product quality and engineering efficiency</p></li></ul> <br><strong>Qualifications</strong><br><br><p dir=""ltr""><strong>Required Qualifications:</strong></p><p dir=""ltr"">&nbsp;</p><ul><li dir=""ltr"">9+ years' experience in software engineering, computer science, or related technical discipline with proven experience maintaining and delivering production software coding in languages including, but not limited to, C, C++, C#, Java, JavaScript, Go, Ruby, Rust, or Python,<ul><li dir=""ltr"">OR associate&rsquo;s degree in Computer Science, Electrical Engineering, Electronics Engineering, Math, Physics, Computer Engineering, Computer Science, or related field AND 8+ years' experience in software engineering, computer science, or related technical discipline with proven experience maintaining and delivering production software coding in languages including, but not limited to, C, C++, C#, Java, JavaScript, Go, Ruby, Rust, or Python,</li><li dir=""ltr"">OR bachelor's degree in Computer Science or related field AND 7+ years' experience in software engineering, computer science, or related technical discipline with proven experience maintaining and delivering production software coding in languages including, but not limited to, C, C++, C#, Java, JavaScript, Go, Ruby, Rust, or Python,</li><li dir=""ltr"">OR master's degree in Computer Science, Electrical Engineering, Electronics Engineering, Math, Physics, Computer Engineering, Computer Science, or related field AND 5+ years' experience in software engineering, computer science, or related technical discipline with proven experience maintaining and delivering production software coding in languages including, but not limited to, C, C++, C#, Java, JavaScript, Go, Ruby, Rust, or Python,</li><li dir=""ltr"">OR doctorate in Computer Science, Electrical Engineering, Electronics Engineering, Math, Physics, Computer Engineering, Computer Science, or related field AND 3+ years' experience in software engineering, computer science, or related technical discipline with proven experience maintaining and delivering production software coding in languages including, but not limited to, C, C++, C#, Java, JavaScript, Go, Ruby, Rust, or Python,</li><li dir=""ltr"">OR equivalent experience.</li></ul></li><li dir=""ltr"">3+ years people management experience</li><li dir=""ltr"">5+ years of experience developing backend services for large scale systems.</li><li dir=""ltr"">1+ years of experience working with data centers and vendors</li></ul><p>&nbsp;</p><p dir=""ltr""><strong>Preferred Qualifications:</strong></p><p dir=""ltr"">&nbsp;</p><ul><li dir=""ltr"">Experience leading engineering teams delivering high-availability enterprise-grade services</li><li dir=""ltr"">Passionate about fostering good engineering practices and processes</li><li dir=""ltr"">Experience developing a strategy and roadmap for your teams</li><li dir=""ltr"">Experience with hiring &amp; building teams</li><li dir=""ltr"">Experience with maintaining production systems including: monitoring, observability and diagnosing problems</li><li dir=""ltr"">Excellent analytical skills as well as communication skills both verbal and written. We&rsquo;re a distributed team so we&rsquo;re extra mindful about communication.</li><li dir=""ltr"">MacOS</li><li dir=""ltr"">Strong customer focus and data driven approach</li><li dir=""ltr"">At least 1 year of remote work experience leading a distributed software team</li><li dir=""ltr"">2+ years of experience on teams building infra as code</li></ul> <br><strong>Compensation Range</strong><br><br>The base salary range for this job is USD $127,600.00 - USD $338,500.00 /Yr.<br><br>These pay ranges are intended to cover roles based across the United States. An individual's base pay depends on various factors including geographical location and review of experience, knowledge, skills, abilities of the applicant. At GitHub certain roles are eligible for benefits and additional rewards, including annual bonus and stock. These rewards are allocated based on individual impact in role. In addition, certain roles also have the opportunity to earn sales incentives based on revenue or utilization, depending on the terms of the plan and the employee's role. <p><strong>GitHub values</strong></p> <ul><li>Customer-obsessed</li> <li>Ship to learn</li> <li>Growth mindset</li> <li>Own the outcome</li> <li>Better together</li> <li>Diverse and inclusive</li></ul> <p><strong>Manager fundamentals</strong></p> <ul><li>Model</li> <li>Coach</li> <li>Care</li></ul> <p><strong>Leadership principles</strong></p> <ul><li>Create clarity</li> <li>Generate energy</li> <li>Deliver success</li></ul> <br><strong>Who We Are</strong><br><br>GitHub is the world’s leading AI-powered developer platform with 150 million developers and counting. We’re also home to the biggest open-source community on earth (and 99% of the world’s software has open-source code in its DNA). Many of the apps and programs you use every day are built on GitHub.<br> Our teams are dreamers, doers, and pioneers, leading the way in AI, driving humanitarian efforts around the globe, and even sending open source to Mars (and beyond!). At GitHub, our goal is to create the space you need to do your best work. We’re remote-first and offer competitive pay, generous learning and growth opportunities, and excellent benefits to support you, wherever you are—because we know that people flourish when they can work on their own terms.<br> Join us, and let’s change the world, together.<br> <br><strong>EEO Statement</strong><br><br>GitHub is made up of people from a wide variety of backgrounds and lifestyles. We embrace diversity and invite applications from people of all walks of life. We don't discriminate against employees or applicants based on gender identity or expression, sexual orientation, race, religion, age, national origin, citizenship, disability, pregnancy status, veteran status, or any other differences. Also, if you have a disability, please let us know if there's any way we can make the interview process better for you; we're happy to accommodate!"
github,4369,"Senior Software Engineer, Data",US Remote,https://careers-githubinc.icims.com/jobs/4369/login,"<strong>About GitHub</strong><br><br>As the global home for all developers, GitHub is the complete AI-powered developer platform to build, scale, and deliver secure software. Over 150+ million developers, including more than 90% of the Fortune 100 companies, use GitHub to collaborate and experiment across 420+ million repositories. With all the collaborative features of GitHub, it has never been easier for individuals and teams to write faster, better code.<br> <br><strong>Locations</strong><br><br>In this role you can work from Remote, United States<br> <br><strong>Overview</strong><br><br><p dir=""ltr""><strong>Senior Software Engineer,&nbsp; Data</strong></p><p dir=""ltr"">&nbsp;</p><p dir=""ltr"">As a software engineer at GitHub, you will enhance the collaboration experience at GitHub by working closely with a community of engineers and designers with a distributed, diverse and passionate team delivering the services that millions of developers depend on. In this role you will design, prototype, implement, ship and support highly performant and inspiring user experiences with your team.</p><p dir=""ltr"">We are looking for creative problem solvers and diverse thinkers, people who care about culture as well as customers and features. We believe that how we do things is as important as what we do. Big vision, a common purpose, passion for quality, curiosity, dedication, and investment in fun and collaboration are what lead to great results. Great products reflect the teams that build them.</p><p>&nbsp;</p> <br><strong>Responsibilities</strong><br><br><ul><li>Design, develop, test and ship high-quality technical solutions that scale across multiple GitHub services.</li><li>Collaborate with cross-functional teams to define and implement innovative solutions.</li><li>Mentor junior engineers</li><li>Provide technical leadership, mentorship, pairing opportunities, and code reviews</li><li>Own and advocate for the health and quality of the systems that the team builds, including participating in on-call and first responder rotations</li><li>Write architecture briefs and proposals, carry out code experiments, and build prototypes to learn how we can achieve planetary scale with our systems.</li><li>Design and implement APIs to facilitate seamless integration between software components.</li><li>Utilize CI/CD tools to set up automated pipelines for continuous integration and delivery.</li><li>Become intimately familiar with the systems you build and take pride in writing maintainable code.</li></ul> <br><strong>Qualifications</strong><br><br><p><strong>Required Qualifications:</strong></p><ul><li>6+ years experience in Software Engineering, Computer Science, or related technical discipline with proven experience maintaining and delivering production software coding in languages including, but not limited to, C, C++, C#, Java, JavaScript, Go, Ruby, Rust, or Python<br /><ul><li>OR Associate&rsquo;s Degree in Computer Science, Electrical Engineering, Electronics Engineering, Math, Physics, Computer Engineering, Computer Science, or related field AND 5+ years experience in Software Engineering, Computer Science, or related technical discipline with proven experience maintaining and delivering production software coding in languages including, but not limited to, C, C++, C#, Java, JavaScript, Go, Ruby, Rust, or Python</li><li>OR Bachelor's Degree in Computer Science, Electrical Engineering, Electronics Engineering, Math, Physics, Computer Engineering, Computer Science, or related field AND 4+ years experience in Software Engineering, Computer Science, or related technical discipline with proven experience maintaining and delivering production software coding in languages including, but not limited to, C, C++, C#, Java, JavaScript, Go, Ruby, Rust, or Python&nbsp;</li><li>OR Master's Degree in Computer Science, Electrical Engineering, Electronics Engineering, Math, Physics, Computer Engineering, Computer Science, or related field AND 2+ years experience in Software Engineering, Computer Science, or related technical discipline with proven experience maintaining and delivering production software coding in languages including, but not limited to, C, C++, C#, Java, JavaScript, Go, Ruby, Rust, or Python</li><li>OR Doctorate in Computer Science, Electrical Engineering, Electronics Engineering, Math, Physics, Computer Engineering, Computer Science, or related fie</li><li>OR equivalent experience.</li></ul></li></ul><p>&nbsp;</p><p><strong>Preferred Qualifications:</strong></p><ul type=""disc""><li>Some experience in one or more scripting languages (e.g., Bash, Python, or a similar language)</li><li>Some experience with cloud environments and/or Cloud Native Compute Foundation (CNCF) concepts</li><li>Experience working with both relational (e.g. mysql) and most importantly non-relational datastores (e.g. Cosmos)</li><li>Some experience with Golang</li><li>Experience working with Azure resource such as Azure Storage (blob and table particularly), Azure Redis Cache, Azure Data Explorer Clusters.</li><li>Experience operating Cosmos DB clusters at scale.</li></ul> <br><strong>Compensation Range</strong><br><br>The base salary range for this job is USD $112,800.00 - USD $299,300.00 /Yr.<br><br>These pay ranges are intended to cover roles based across the United States. An individual's base pay depends on various factors including geographical location and review of experience, knowledge, skills, abilities of the applicant. At GitHub certain roles are eligible for benefits and additional rewards, including annual bonus and stock. These rewards are allocated based on individual impact in role. In addition, certain roles also have the opportunity to earn sales incentives based on revenue or utilization, depending on the terms of the plan and the employee's role. <p><strong>GitHub values</strong></p> <ul><li>Customer-obsessed</li> <li>Ship to learn</li> <li>Growth mindset</li> <li>Own the outcome</li> <li>Better together</li> <li>Diverse and inclusive</li></ul> <p><strong>Manager fundamentals</strong></p> <ul><li>Model</li> <li>Coach</li> <li>Care</li></ul> <p><strong>Leadership principles</strong></p> <ul><li>Create clarity</li> <li>Generate energy</li> <li>Deliver success</li></ul> <br><strong>Who We Are</strong><br><br>GitHub is the world’s leading AI-powered developer platform with 150 million developers and counting. We’re also home to the biggest open-source community on earth (and 99% of the world’s software has open-source code in its DNA). Many of the apps and programs you use every day are built on GitHub.<br> Our teams are dreamers, doers, and pioneers, leading the way in AI, driving humanitarian efforts around the globe, and even sending open source to Mars (and beyond!). At GitHub, our goal is to create the space you need to do your best work. We’re remote-first and offer competitive pay, generous learning and growth opportunities, and excellent benefits to support you, wherever you are—because we know that people flourish when they can work on their own terms.<br> Join us, and let’s change the world, together.<br> <br><strong>EEO Statement</strong><br><br>GitHub is made up of people from a wide variety of backgrounds and lifestyles. We embrace diversity and invite applications from people of all walks of life. We don't discriminate against employees or applicants based on gender identity or expression, sexual orientation, race, religion, age, national origin, citizenship, disability, pregnancy status, veteran status, or any other differences. Also, if you have a disability, please let us know if there's any way we can make the interview process better for you; we're happy to accommodate!"
