company,id,title,location,url,notes
github,2786,"Senior Software Engineer, Edge (Infra)",US Remote,https://careers-githubinc.icims.com/jobs/2786/login,"About GitHub As the global home for all developers, GitHub is the complete AI-powered developer platform to build, scale, and deliver secure software. Over 100 million people, including developers from 90 of the Fortune 100 companies, use GitHub to build amazing things together across 330+ million repositories. With all the collaborative features of GitHub, it has never been easier for individuals and teams to write faster, better code. Locations In this role you can work from Remote, United States Overview GitHub is looking for engineers to join the Traffic Engineering team within our larger Infrastructure Engineering organization. You will focus on the systems and tools that enable our engineers to operate and scale the world's largest code hosting platform. You will help develop and maintain our edge and internal load balancing and caching infrastructure. You will also help improve end user performance through the expansion our global network. Nearly every byte in and out of GitHub’s network will traverse systems you own. The Infrastructure Engineering team is highly distributed and you will thrive in an environment of remote work and asynchronous communication. You're expected to have strong written communication skills and be able to develop working relationships with coworkers in locations around the globe. As an engineer at GitHub you'll always be challenged to solve interesting and novel problems that have real impact on how the world builds software. Responsibilities Design, build and maintain core components of the GitHub Edge stack. Cultivate GLB and other open source projects developed by GitHub and build things you are proud to share. Work closely with our application, network, observability, virtualization, and security teams to build secure, feature rich, and performant software in support of our global platform. Help to take your code to production, troubleshoot any issues that arise, and own fixing any associated bugs. Qualifications Minimum Qualifications: 5+ years of experience with Linux kernel, network programming and/or HAProxy at scale 5+ years experience with core functionality of standard protocols such as TCP, UDP, HTTP, TLS, GRE, and/or DNS 5+ years proficiency in one (or more) language(s) like Ruby, Python, or Golang 3+ years deploying systems with Terraform, Ansible, and/or Puppet Bachelor's degree or equivalent experience Preferred Qualifications: Application layer DDoS remediation techniques and experience, especially in a network edge environment Knowledge of when and how to deploy web acceleration techniques (e.g. caching, persistent connections, network stack tuning). Experience diagnosing and resolving performance problems at the intersection of software and hardware. You take a pragmatic approach to decision making and design choices. Azure technologies or cloud migrations of production environments Demonstrated experience with technologies such as anycast, BGP, XDP, eBPF, or P4. Experience using GitHub as a software development platform. Comfort working as part of a geographically distributed team and in a highly available environment. Hands-on experience running services in a distributed infrastructure. Compensation Range The base salary range for this job is USD $104,400.00 - USD $276,900.00 /Yr. In addition, certain roles also have the opportunity to earn sales incentives based on revenue or utilization, depending on the terms of the plan and the employee's role. These pay ranges are intended to cover roles based across the United States. An individual's base pay depends on various factors including geographical location and review of experience, knowledge, skills, abilities of the applicant. At GitHub certain roles are eligible for benefits and additional rewards, including annual bonus and stock. These rewards are allocated based on individual impact in role. In addition, certain roles also have the opportunity to earn sales incentives based on revenue or utilization, depending on the terms of the plan and the employee's role. GitHub values Customer-obsessed Ship to learn Growth mindset Own the outcome Better together Diverse and inclusive Manager fundamentals Model Coach Care Leadership principles Create clarity Generate energy Deliver success Who We Are GitHub is the world’s leading AI-powered developer platform with 100 million developers and counting. We’re also home to the biggest open-source community on earth (and 99% of the world’s software has open-source code in its DNA). Many of the apps and programs you use every day are built on GitHub. Our teams are dreamers, doers, and pioneers, leading the way in AI, driving humanitarian efforts around the globe, and even sending open source to Mars (and beyond!). At GitHub, our goal is to create the space you need to do your best work. We’re remote-first and offer competitive pay, generous learning and growth opportunities, and excellent benefits to support you, wherever you are—because we know that people flourish when they can work on their own terms. Join us, and let’s change the world, together. EEO Statement GitHub is made up of people from a wide variety of backgrounds and lifestyles. We embrace diversity and invite applications from people of all walks of life. We don't discriminate against employees or applicants based on gender identity or expression, sexual orientation, race, religion, age, national origin, citizenship, disability, pregnancy status, veteran status, or any other differences. Also, if you have a disability, please let us know if there's any way we can make the interview process better for you; we're happy to accommodate!"
github,2855,Senior CodeQL Analysis Engineer,United Kingdom Remote,https://globalcareers-githubinc.icims.com/jobs/2855/login,"About GitHub As the global home for all developers, GitHub is the complete AI-powered developer platform to build, scale, and deliver secure software. Over 100 million people, including developers from 90 of the Fortune 100 companies, use GitHub to build amazing things together across 330+ million repositories. With all the collaborative features of GitHub, it has never been easier for individuals and teams to write faster, better code. Locations In this role you can work from Remote, United Kingdom Overview GitHub is seeking a Senior CodeQL Analysis Engineer for our CodeQL Expert Services team. CodeQL is GitHub's industry-leading semantic code analysis engine that lets you query code as though it were data, and is usually deployed as part of our wider GitHub Advanced Security offering. Our team supports the adoption of CodeQL amongst some of our largest and most interesting customers. As a Senior CodeQL Analysis Engineer, you will have a direct impact on the security of some of the world’s largest code bases and the most commonly used applications. Acting as a trusted advisor, you will work closely with our customers' security teams to support them in their use of CodeQL: developing bespoke solutions using CodeQL, providing recommendations, training and working on implementing custom static analyses to help discover critical vulnerabilities in their code. We are looking for a passionate technologist who can apply cutting-edge static analysis techniques to messy real-world problems and teach our customers how to do the same. Examples of past projects the team have undertaken include the development of over 850 CodeQL queries to cover various C/C++ Coding Standards for use in functional safety workflows in the automotive industry, the creation of a CodeQL development toolkit for supporting custom CodeQL development, working with customers to validate static contracts in C/C++ code using CodeQL and deploying cutting-edge AI technology in order to drive automatic remediation of security vulnerabilities. We also work to train customers in the use of CodeQL and help drive adoption through increasing library and framework coverage for our security queries. Responsibilities Develop creative bespoke solutions using CodeQL to help solve challenging customer problems Use CodeQL to develop static analyses to find vulnerabilities in our customers' code Refine and scale analyses so they can be run across 1000s of codebases Provide CodeQL training for developers and security engineers Support the product development and adoption of AI-powered CodeQL features, such as autofix, through customer engagements Be a trusted advisor for our customers on all aspects of CodeQL Qualifications Required Qualifications: Several years of experience as a software engineer, software consultant, or software security engineer and fluent in software development fundamentals (version control using git, pull request workflows etc.) or equivalent education in relevant fields Multiple years of experience in developing or customizing source code analysis tools, compilers, debuggers, IDE tools or similar and a strong understanding of programming language fundamentals Demonstrable ability with at least one of the languages supported by CodeQL (C, C++, C#, Java, JavaScript/TypeScript, Python, Ruby, Kotlin, Swift and Go) Preferred Qualifications Implementing or working with static analysis, with a particular focus on taint tracking or abstract interpretation; or experience implementing high-level languages (interpreters or compilers) Logic Programming (Datalog, Prolog, CodeQL) or Functional Programming (Haskell, OCaml, Lisp, etc.) Secure coding practices and triaging common types of security vulnerabilities Relational database fundamentals Working directly with customers or stakeholders to scope, propose and implement technical solutions Mentoring and educating other engineers and disseminating complex technical ideas and processes GitHub values Customer-obsessed Ship to learn Growth mindset Own the outcome Better together Diverse and inclusive Manager fundamentals Model Coach Care Leadership principles Create clarity Generate energy Deliver success Who We Are GitHub is the world’s leading AI-powered developer platform with 100 million developers and counting. We’re also home to the biggest open-source community on earth (and 99% of the world’s software has open-source code in its DNA). Many of the apps and programs you use every day are built on GitHub. Our teams are dreamers, doers, and pioneers, leading the way in AI, driving humanitarian efforts around the globe, and even sending open source to Mars (and beyond!). At GitHub, our goal is to create the space you need to do your best work. We’re remote-first and offer competitive pay, generous learning and growth opportunities, and excellent benefits to support you, wherever you are—because we know that people flourish when they can work on their own terms. Join us, and let’s change the world, together."
github,2875,Software Engineer,United Kingdom Remote,https://globalcareers-githubinc.icims.com/jobs/2875/login,"About GitHub As the global home for all developers, GitHub is the complete AI-powered developer platform to build, scale, and deliver secure software. Over 100 million people, including developers from 90 of the Fortune 100 companies, use GitHub to build amazing things together across 330+ million repositories. With all the collaborative features of GitHub, it has never been easier for individuals and teams to write faster, better code. Locations In this role you can work from Remote, United Kingdom Overview GitHub is the home for software development, where we collaborate to build the world's leading developer platform. In the GitHub code scanning team, we are passionate about securing the world’s software - from open source to the enterprise. We believe that the best way to secure software is to detect security issues early in the development process, and deliver a great user experience that engages, supports, and motivates developers to fix security vulnerabilities in a way that integrates naturally in their workflows. Our team develops and operates the new code scanning product that’s part of GitHub’s Advanced Security offering. Code scanning uses world-class static analysis research and technology to deeply analyze code, enabling the early detection of security vulnerabilities and other bugs that testing and day-to-day use have missed. Responsibilities The opportunity: Come join our engineering team and help design, develop, and scale GitHub’s new Code Scanning feature. You’ll be working in a full-stack agile engineering team that’s part of the larger code scanning group working in security products. You will work closely with various engineering teams, product managers, designers, and technical writers that build different aspects of the code scanning product, to influence product direction and deliver features to users, with clear focus on quality, reliability, and user experience. You will engage with internal users and external users (both from enterprise customers and the open-source community) to help them succeed with the product. You will grow and scale the product, working as part of our Security Products group towards our mission of securing the world’s software. You’ll influence and provide feedback on the organizational culture and processes, always looking for opportunities to improve in a continuous pursuit of excellence. What will your first 3 months look like? In the first week on the job, you’ll have deployed your first change to GitHub in production! After 30 days, you’ll be a core part of the team working together with your team-mates on changes and features that are key priorities for GitHub this year. Within the first three months, you’ll have had the opportunity to co-lead one or more features/product-changes that will be included in our next marketed product launch. We work as a distributed group within a distributed company. The majority of our team members live in Europe and on the east coast of the US, and while we do have some offices, all our meetings are location-agnostic and happen online. We operate with a high degree of autonomy and trust, and we have a significant level of influence on the product and technical direction of code scanning, as well as the broader security products at GitHub. We value learning, introspection and reflection, and we’re always looking for ways to improve as a team and as individuals, so candor and a culture that values safety to speak up are highly important to us. Qualifications Minimum Qualifications: For this role, we’re looking for an experienced software engineer with: Several years of experience building, operating, and maintaining resilient, highly available, scalable, distributed services Several years of professional experience building web applications with Go or Ruby/Ruby on Rails and related tooling Some professional experience with MySQL Preferred Qualifications: Several years of experience working with Typescript The ability to work with multiple stakeholders and teams across engineering, product, and design Experience operating user-facing software at scale, including availability and observability Experience working in a distributed team, operating effectively across multiple time zones A passion for fostering good engineering practices, tools, and processes GitHub values Customer-obsessed Ship to learn Growth mindset Own the outcome Better together Diverse and inclusive Manager fundamentals Model Coach Care Leadership principles Create clarity Generate energy Deliver success Who We Are GitHub is the world’s leading AI-powered developer platform with 100 million developers and counting. We’re also home to the biggest open-source community on earth (and 99% of the world’s software has open-source code in its DNA). Many of the apps and programs you use every day are built on GitHub. Our teams are dreamers, doers, and pioneers, leading the way in AI, driving humanitarian efforts around the globe, and even sending open source to Mars (and beyond!). At GitHub, our goal is to create the space you need to do your best work. We’re remote-first and offer competitive pay, generous learning and growth opportunities, and excellent benefits to support you, wherever you are—because we know that people flourish when they can work on their own terms. Join us, and let’s change the world, together."
github,2900,Software Engineer III,Germany Remote,https://globalcareers-githubinc.icims.com/jobs/2900/login,"About GitHub As the global home for all developers, GitHub is the complete AI-powered developer platform to build, scale, and deliver secure software. Over 100 million people, including developers from 90 of the Fortune 100 companies, use GitHub to build amazing things together across 330+ million repositories. With all the collaborative features of GitHub, it has never been easier for individuals and teams to write faster, better code. Locations In this role you can work from Remote, Germany Overview GitHub is the home for software development, where we collaborate to build the world's leading developer platform. In the GitHub code scanning team, we are passionate about securing the world’s software - from open source to the enterprise. We believe that the best way to secure software is to detect security issues early in the development process, and deliver a great user experience that engages, supports, and motivates developers to fix security vulnerabilities in a way that integrates naturally in their workflows. Our team develops and operates the new code scanning product that’s part of GitHub’s Advanced Security offering. Code scanning uses world-class static analysis research and technology to deeply analyze code, enabling the early detection of security vulnerabilities and other bugs that testing and day-to-day use have missed. Responsibilities Come join our engineering team and help design, develop, and scale GitHub’s new Code Scanning feature. You’ll be working in a full-stack agile engineering team that’s part of the larger code scanning group working in security products. You will work closely with various engineering teams, product managers, designers, and technical writers that build different aspects of the code scanning product, to influence product direction and deliver features to users, with clear focus on quality, reliability, and user experience. You will engage with internal users and external users (both from enterprise customers and the open-source community) to help them succeed with the product. You will grow and scale the product, working as part of our Security Products group towards our mission of securing the world’s software. You’ll influence and provide feedback on the organizational culture and processes, always looking for opportunities to improve in a continuous pursuit of excellence. What will your first 3 months look like? In the first week on the job, you’ll have deployed your first change to GitHub in production! After 30 days, you’ll be a core part of the team working together with your team-mates on changes and features that are key priorities for GitHub this year. Within the first three months, you’ll have had the opportunity to co-lead one or more features/product-changes that will be included in our next marketed product launch. We work as a distributed group within a distributed company. The majority of our team members live in Europe and on the east coast of the US, and while we do have some offices, all our meetings are location-agnostic and happen online. We operate with a high degree of autonomy and trust, and we have a significant level of influence on the product and technical direction of code scanning, as well as the broader security products at GitHub. We value learning, introspection and reflection, and we’re always looking for ways to improve as a team and as individuals, so candor and a culture that values safety to speak up are highly important to us. Qualifications Minimum Qualifications: Several years of experience building, operating, and maintaining resilient, highly available, scalable, distributed services Several years of professional experience building web applications with Go or Ruby/Ruby on Rails and related tooling Some professional experience with MySQL Preferred Qualifications: Several years of experience working with Typescript The ability to work with multiple stakeholders and teams across engineering, product, and design Experience operating user-facing software at scale, including availability and observability Experience working in a distributed team, operating effectively across multiple time zones A passion for fostering good engineering practices, tools, and processes GitHub values Customer-obsessed Ship to learn Growth mindset Own the outcome Better together Diverse and inclusive Manager fundamentals Model Coach Care Leadership principles Create clarity Generate energy Deliver success Who We Are GitHub is the world’s leading AI-powered developer platform with 100 million developers and counting. We’re also home to the biggest open-source community on earth (and 99% of the world’s software has open-source code in its DNA). Many of the apps and programs you use every day are built on GitHub. Our teams are dreamers, doers, and pioneers, leading the way in AI, driving humanitarian efforts around the globe, and even sending open source to Mars (and beyond!). At GitHub, our goal is to create the space you need to do your best work. We’re remote-first and offer competitive pay, generous learning and growth opportunities, and excellent benefits to support you, wherever you are—because we know that people flourish when they can work on their own terms. Join us, and let’s change the world, together."
