company,id,title,location,url,notes
github,4448,"Senior Director, Software Engineering, Copilot Platform",US Remote,https://careers-githubinc.icims.com/jobs/4448/login,"About GitHub As the global home for all developers, GitHub is the complete AI-powered developer platform to build, scale, and deliver secure software. Over 150+ million developers, including more than 90% of the Fortune 100 companies, use GitHub to collaborate and experiment across 420+ million repositories. With all the collaborative features of GitHub, it has never been easier for individuals and teams to write faster, better code. Locations In this role you can work from Remote, United States Overview GitHub is looking for a Senior Director of Engineering to lead the development of the GitHub Copilot AI inference platform. This role involves overseeing the allocation and deployment of GitHub's AI resources, managing high-throughput service infrastructure for inference workloads, and improving the experiment-to-production pipeline. This includes operating orchestration frameworks that support generative AI workloads at scale. The ideal candidate will possess a strategic vision, technical leadership in distributed systems and generative AI serving architectures, as well as the ability to mentor senior engineering leaders, build empowered high-trust teams, and foster a culture of technical excellence and experimentation. The AI infrastructure at GitHub is crucial for the future of software development. As Senior Director of Engineering, you will lead four service-owning teams responsible for this foundation, ensuring efficient, secure, and business-aligned resource deployment. You will work with a team of architects to guide the platform's evolution through deep technical leadership and organizational stewardship, collaborating with product, infrastructure, and research teams across GitHub and Microsoft to scale, optimize, and safeguard platform integrity. This is a unique opportunity to shape the systems powering Copilot and other AI-driven experiences globally. We foster a culture that prioritizes developer empathy, transparency, and inclusive collaboration, where curiosity and impact drive our development efforts. Responsibilities Lead strategic alignment across teams to define and evolve the architecture of GitHub’s GPU infrastructure and AI serving platform. Oversee capacity planning, dynamic traffic shaping, and abuse mitigation systems to ensure performance, reliability, and compliance. Guide teams in designing scalable, secure, and observable systems that meet business and technical requirements. Champion experimentation and telemetry-driven development, enabling rapid iteration and data-informed decisions. Drive engineering excellence through automation, tooling, and standardization across deployment, testing, and operations. Foster cross-functional collaboration with product, design, and engineering leadership to align technical strategy with business goals. Mentor senior engineering leaders and cultivate a high-trust, high-performance culture across distributed teams. Own incident response and reliability practices, ensuring live services meet SLOs and postmortems drive systemic improvements. Work with architects to shape GitHub’s long-term vision for AI infrastructure, identifying opportunities for innovation and leading initiatives that scale globally. Qualifications Required/Minimum Qualifications 11+ years' experience in Software Engineering, Computer Science, or related technical discipline with proven experience maintaining and delivering production software coding in languages including, but not limited to, C, C++, C#, Java, JavaScript, Go, Ruby, Rust, or Python, OR Associate’s Degree in Computer Science, Electrical Engineering, Electronics Engineering, Math, Physics, Computer Engineering, Computer Science, or related field AND 10+ years' experience in Software Engineering, Computer Science, or related technical discipline with proven experience maintaining and delivering production software coding in languages including, but not limited to, C, C++, C#, Java, JavaScript, Go, Ruby, Rust, or Python, OR Bachelor's Degree in Computer Science or related field AND 9+ years' experience in Software Engineering, Computer Science, or related technical discipline with proven experience maintaining and delivering production software coding in languages including, but not limited to, C, C++, C#, Java, JavaScript, Go, Ruby, Rust, or Python, OR Master's Degree in Computer Science, Electrical Engineering, Electronics Engineering, Math, Physics, Computer Engineering, Computer Science, or related field AND 7+ years' experience in Software Engineering, Computer Science, or related technical discipline with proven experience maintaining and delivering production software coding in languages including, but not limited to, C, C++, C#, Java, JavaScript, Go, Ruby, Rust, or Python, OR Doctorate in Computer Science, Electrical Engineering, Electronics Engineering, Math, Physics, Computer Engineering, Computer Science, or related field AND 5+ years' experience in Software Engineering, Computer Science, or related technical discipline with proven experience maintaining and delivering production software coding in languages including, but not limited to, C, C++, C#, Java, JavaScript, Go, Ruby, Rust, or Python, OR equivalent experience. 5+ years people management experience. Preferred Qualifications Deep understanding of distributed systems performance, including autoscaling, load balancing, and traffic shaping for inference workloads. Proven track record of building and scaling engineering organizations in high-growth or ambiguous environments. Experience collaborating across product, design, and engineering to align technical strategy with business outcomes. Compensation Range The base salary range for this job is USD $145,600.00 - USD $386,400.00 /Yr. These pay ranges are intended to cover roles based across the United States. An individual's base pay depends on various factors including geographical location and review of experience, knowledge, skills, abilities of the applicant. At GitHub certain roles are eligible for benefits and additional rewards, including annual bonus and stock. These rewards are allocated based on individual impact in role. In addition, certain roles also have the opportunity to earn sales incentives based on revenue or utilization, depending on the terms of the plan and the employee's role. GitHub values Customer-obsessed Ship to learn Growth mindset Own the outcome Better together Diverse and inclusive Manager fundamentals Model Coach Care Leadership principles Create clarity Generate energy Deliver success Who We Are GitHub is the world’s leading AI-powered developer platform with 150 million developers and counting. We’re also home to the biggest open-source community on earth (and 99% of the world’s software has open-source code in its DNA). Many of the apps and programs you use every day are built on GitHub. Our teams are dreamers, doers, and pioneers, leading the way in AI, driving humanitarian efforts around the globe, and even sending open source to Mars (and beyond!). At GitHub, our goal is to create the space you need to do your best work. We’re remote-first and offer competitive pay, generous learning and growth opportunities, and excellent benefits to support you, wherever you are—because we know that people flourish when they can work on their own terms. Join us, and let’s change the world, together. EEO Statement GitHub is made up of people from a wide variety of backgrounds and lifestyles. We embrace diversity and invite applications from people of all walks of life. We don't discriminate against employees or applicants based on gender identity or expression, sexual orientation, race, religion, age, national origin, citizenship, disability, pregnancy status, veteran status, or any other differences. Also, if you have a disability, please let us know if there's any way we can make the interview process better for you; we're happy to accommodate!"
github,4450,"Principal Software Engineer, Copilot Platform",US Remote,https://careers-githubinc.icims.com/jobs/4450/login,"About GitHub As the global home for all developers, GitHub is the complete AI-powered developer platform to build, scale, and deliver secure software. Over 150+ million developers, including more than 90% of the Fortune 100 companies, use GitHub to collaborate and experiment across 420+ million repositories. With all the collaborative features of GitHub, it has never been easier for individuals and teams to write faster, better code. Locations In this role you can work from Remote, United States Overview GitHub is looking for a Principal Software Engineer to join its growing Engineering team. This leadership role involves leading system architecture design, coaching engineering teams, and delivering impactful technical solutions. The ideal candidate will have deep expertise in scalable systems and performance engineering, including tuning and optimizing high-throughput services in production environments. They thrive in cross-functional environments and bring creative, pragmatic solutions to complex engineering challenges. As a Principal Software Engineer on the GitHub Copilot Platform, you will collaborate with a distributed, diverse, and passionate team of engineers and product managers across GitHub and other partners. The GitHub Copilot Platform is crucial for ensuring the quality, scale, and global expansion of Copilot features, maintaining its industry-leading status, and empowering other GitHub engineering teams with seamless integration. You will lead through personal contributions and by coaching others, as well as guiding technical strategy, architectural decisions, and performance optimization across teams. Our goal is to continuously enhance AI-powered capabilities within GitHub and beyond, improving and maintaining the platform that integrators depend on in their development cycles. We operate in a culture that values developer empathy, transparency, and inclusive collaboration, where curiosity and impact drive everything we build. Responsibilities Lead and influence system architecture design for complex products and solutions, ensuring they meet security, compliance, and performance requirements. Establish and mentor best practices for testing, performance tuning, and code quality, defining success metrics and ensuring maintainability across dependencies. Provide technical leadership during code reviews to ensure reliability, scalability, and alignment with product goals. Partner with product managers and technical leads to define service requirements and incorporate feedback into future designs. Act as an expert in debugging tools and methods, leading proactive and reactive development to resolve issues across teams. Optimize deployments and runtime performance to meet business objectives, ensuring safe rollouts aligned with GitHub’s standards. Drive improvements in development quality and team performance through tooling, automation, and knowledge sharing. Lead product refinement through telemetry analysis, performance metrics, and experimentation frameworks to inform engineering decisions. Develop strategies to identify and mitigate technical risks, including frameworks for risk assessment and contingency planning. Shape the strategic vision for technology and product development, identifying opportunities for innovation and leading initiatives aligned with GitHub’s long-term goals. Qualifications Required Qualifications: 11+ years' experience in Software Engineering, Computer Science, or related technical discipline with proven experience maintaining and delivering production software coding in languages including, but not limited to, C, C++, C#, Java, JavaScript, Go, Ruby, Rust, or Python, OR Associate’s Degree in Computer Science, Electrical Engineering, Electronics Engineering, Math, Physics, Computer Engineering, Computer Science, or related field AND 10+ years' experience in Software Engineering, Computer Science, or related technical discipline with proven experience maintaining and delivering production software coding in languages including, but not limited to, C, C++, C#, Java, JavaScript, Go, Ruby, Rust, or Python, OR Bachelor's Degree in Computer Science or related field AND 9+ years' experience in Software Engineering, Computer Science, or related technical discipline with proven experience maintaining and delivering production software coding in languages including, but not limited to, C, C++, C#, Java, JavaScript, Go, Ruby, Rust, or Python, OR Master's Degree in Computer Science, Electrical Engineering, Electronics Engineering, Math, Physics, Computer Engineering, Computer Science, or related field AND 7+ years' experience in Software Engineering, Computer Science, or related technical discipline with proven experience maintaining and delivering production software coding in languages including, but not limited to, C, C++, C#, Java, JavaScript, Go, Ruby, Rust, or Python, OR Doctorate in Computer Science, Electrical Engineering, Electronics Engineering, Math, Physics, Computer Engineering, Computer Science, or related field AND 5+ years' experience in Software Engineering, Computer Science, or related technical discipline with proven experience maintaining and delivering production software coding in languages including, but not limited to, C, C++, C#, Java, JavaScript, Go, Ruby, Rust, or Python, OR equivalent experience. Experience contributing technical solutions to high throughput services in production environments, such as systems profiling tools and distributed systems performance tuning. Preferred Qualifications: Proven experience designing and operating high-throughput cloud-native distributed systems in production environments. Deep understanding of performance profiling, observability, and telemetry-driven optimization, especially in Go or similar languages Experience integrating machine learning or generative AI capabilities into production systems. Experience driving cross-functional projects in close partnership with product management, design, and engineering teams. Strong communication and leadership skills, with a track record of mentoring senior engineers and influencing engineering culture. Compensation Range The base salary range for this job is USD $145,600.00 - USD $386,400.00 /Yr. These pay ranges are intended to cover roles based across the United States. An individual's base pay depends on various factors including geographical location and review of experience, knowledge, skills, abilities of the applicant. At GitHub certain roles are eligible for benefits and additional rewards, including annual bonus and stock. These rewards are allocated based on individual impact in role. In addition, certain roles also have the opportunity to earn sales incentives based on revenue or utilization, depending on the terms of the plan and the employee's role. GitHub values Customer-obsessed Ship to learn Growth mindset Own the outcome Better together Diverse and inclusive Manager fundamentals Model Coach Care Leadership principles Create clarity Generate energy Deliver success Who We Are GitHub is the world’s leading AI-powered developer platform with 150 million developers and counting. We’re also home to the biggest open-source community on earth (and 99% of the world’s software has open-source code in its DNA). Many of the apps and programs you use every day are built on GitHub. Our teams are dreamers, doers, and pioneers, leading the way in AI, driving humanitarian efforts around the globe, and even sending open source to Mars (and beyond!). At GitHub, our goal is to create the space you need to do your best work. We’re remote-first and offer competitive pay, generous learning and growth opportunities, and excellent benefits to support you, wherever you are—because we know that people flourish when they can work on their own terms. Join us, and let’s change the world, together. EEO Statement GitHub is made up of people from a wide variety of backgrounds and lifestyles. We embrace diversity and invite applications from people of all walks of life. We don't discriminate against employees or applicants based on gender identity or expression, sexual orientation, race, religion, age, national origin, citizenship, disability, pregnancy status, veteran status, or any other differences. Also, if you have a disability, please let us know if there's any way we can make the interview process better for you; we're happy to accommodate!"
github,4455,"Senior Software Engineer, Actions",US Remote,https://careers-githubinc.icims.com/jobs/4455/login,"About GitHub As the global home for all developers, GitHub is the complete AI-powered developer platform to build, scale, and deliver secure software. Over 150+ million developers, including more than 90% of the Fortune 100 companies, use GitHub to collaborate and experiment across 420+ million repositories. With all the collaborative features of GitHub, it has never been easier for individuals and teams to write faster, better code. Locations In this role you can work from Remote, United States Overview GitHub Actions is looking for a great Senior Software Engineer to join our team! Actions powers automation for millions of developers worldwide, enabling them to build, test, and deploy code directly from their repositories. As the backbone of CI/CD workflows across GitHub, Actions processes billions of jobs monthly - from simple builds to complex deployment pipelines spanning multiple environments. Our Hosted Compute team builds services and infrastructure that enable those jobs to run on ephemeral Linux, Mac, and Windows runners reliably, securely, and starting in seconds. We're a group of engineers passionate about developer productivity, tackling challenges in distributed systems, container orchestration, and cloud infrastructure. You'll work alongside talented colleagues who value collaboration, operational excellence, and building products that developers love. We are looking for creative problem solvers and diverse thinkers, people who care about culture as well as customers and features. We believe that how we do things is as important as what we do. Big vision, a common purpose, passion for quality, curiosity, dedication, and investment in fun and collaboration are what lead to great results. Great products reflect the teams that build them. Responsibilities Design, develop, test and ship high-quality technical solutions that scale across multiple GitHub services. Collaborate with cross-functional teams to define and implement innovative solutions. Provide technical leadership, mentorship, pairing opportunities, and code reviews to encourage the growth of others. Own and advocate for the health and quality of the systems that the team builds, including participating in on-call and first responder rotations Write architecture briefs and proposals, carry out code experiments, and build prototypes to learn how we can achieve planetary scale with our systems. Design and implement APIs to facilitate seamless integration between software components. Utilize CI/CD tools to set up automated pipelines for continuous integration and delivery. Become intimately familiar with the systems you build and take pride in writing maintainable code. Qualifications Required Qualifications: 6+ years experience in Software Engineering, Computer Science, or related technical discipline with proven experience maintaining and delivering production software coding in languages including, but not limited to, C, C++, C#, Java, JavaScript, Go, Ruby, Rust, or Python OR Associate’s Degree in Computer Science, Electrical Engineering, Electronics Engineering, Math, Physics, Computer Engineering, Computer Science, or related field AND 5+ years experience in Software Engineering, Computer Science, or related technical discipline with proven experience maintaining and delivering production software coding in languages including, but not limited to, C, C++, C#, Java, JavaScript, Go, Ruby, Rust, or Python OR Bachelor's Degree in Computer Science, Electrical Engineering, Electronics Engineering, Math, Physics, Computer Engineering, Computer Science, or related field AND 4+ years experience in Software Engineering, Computer Science, or related technical discipline with proven experience maintaining and delivering production software coding in languages including, but not limited to, C, C++, C#, Java, JavaScript, Go, Ruby, Rust, or Python OR Master's Degree in Computer Science, Electrical Engineering, Electronics Engineering, Math, Physics, Computer Engineering, Computer Science, or related field AND 2+ years experience in Software Engineering, Computer Science, or related technical discipline with proven experience maintaining and delivering production software coding in languages including, but not limited to, C, C++, C#, Java, JavaScript, Go, Ruby, Rust, or Python OR Doctorate in Computer Science, Electrical Engineering, Electronics Engineering, Math, Physics, Computer Engineering, Computer Science, or related fie OR equivalent experience. 2+ years experience developing and operating large-scale services or infrastructure Preferred Qualifications: 2+ years experience in one or more scripting languages (e.g., Bash, Python, or a similar language) 2+ years experience using general purpose programming languages (e.g., Go, Ruby, or a similar language). 3+ years experience with cloud environments and/or Cloud Native Compute Foundation (CNCF) concepts. Experience with MacOS or iOS development Compensation Range The base salary range for this job is USD $112,800.00 - USD $299,300.00 /Yr. These pay ranges are intended to cover roles based across the United States. An individual's base pay depends on various factors including geographical location and review of experience, knowledge, skills, abilities of the applicant. At GitHub certain roles are eligible for benefits and additional rewards, including annual bonus and stock. These rewards are allocated based on individual impact in role. In addition, certain roles also have the opportunity to earn sales incentives based on revenue or utilization, depending on the terms of the plan and the employee's role. GitHub values Customer-obsessed Ship to learn Growth mindset Own the outcome Better together Diverse and inclusive Manager fundamentals Model Coach Care Leadership principles Create clarity Generate energy Deliver success Who We Are GitHub is the world’s leading AI-powered developer platform with 150 million developers and counting. We’re also home to the biggest open-source community on earth (and 99% of the world’s software has open-source code in its DNA). Many of the apps and programs you use every day are built on GitHub. Our teams are dreamers, doers, and pioneers, leading the way in AI, driving humanitarian efforts around the globe, and even sending open source to Mars (and beyond!). At GitHub, our goal is to create the space you need to do your best work. We’re remote-first and offer competitive pay, generous learning and growth opportunities, and excellent benefits to support you, wherever you are—because we know that people flourish when they can work on their own terms. Join us, and let’s change the world, together. EEO Statement GitHub is made up of people from a wide variety of backgrounds and lifestyles. We embrace diversity and invite applications from people of all walks of life. We don't discriminate against employees or applicants based on gender identity or expression, sexual orientation, race, religion, age, national origin, citizenship, disability, pregnancy status, veteran status, or any other differences. Also, if you have a disability, please let us know if there's any way we can make the interview process better for you; we're happy to accommodate!"
