company,id,title,location,url,notes
github,4691,"Staff Applied Researcher, AI Quality",US Remote,https://careers-githubinc.icims.com/jobs/4691/login,"<strong>About GitHub</strong><br><br>GitHub is the world’s leading platform for agentic software development — powered by Copilot to build, scale, and deliver secure software. Over 180 million developers, including more than 90% of the Fortune 100 companies, use GitHub to collaborate, and more than 77,000 organisations have adopted GitHub Copilot.<br> <br><strong>Locations</strong><br><br>In this role you can work from Remote, United States<br> <br><strong>Overview</strong><br><br><p dir=""ltr"">At GitHub, we&rsquo;re building the next generation of AI‑powered developer experiences. We&rsquo;re looking for a Staff Applied Researcher with deep expertise in Large Language Model (LLM) evaluation, LLM agents, strong engineering instincts, and a bias for action to help shape the future of GitHub Copilot and our AI platform.</p><p dir=""ltr"">This is a high‑impact role where you will design evaluation systems that directly influence how millions of developers experience AI every day.</p><p>&nbsp;</p> <br><strong>Responsibilities</strong><br><br><p dir=""ltr""><strong>Lead Model Quality &amp; Evaluation</strong></p><ul><li dir=""ltr"" style=""list-style-type: disc;"" aria-level=""1""><p dir=""ltr"" role=""presentation"">Design next‑generation evaluation frameworks for code generation, reasoning, safety, multimodal tasks, and agentic workflows.</p></li><li dir=""ltr"" style=""list-style-type: disc;"" aria-level=""1""><p dir=""ltr"" role=""presentation"">Develop scalable automatic metrics, LLM‑judge systems, reward models, and human‑in‑the‑loop evaluation pipelines.</p></li><li dir=""ltr"" style=""list-style-type: disc;"" aria-level=""1""><p dir=""ltr"" role=""presentation"">Establish high‑signal, repeatable methodologies that influence product decisions across GitHub AI.</p></li></ul><h3 dir=""ltr""><span style=""font-size: 9pt;"">Drive Applied Research &amp; Engineering</span></h3><ul><li dir=""ltr"" style=""list-style-type: disc;"" aria-level=""1""><p dir=""ltr"" role=""presentation"">Build and optimize evaluation tooling, datasets, benchmarking systems, and experimentation pipelines.</p></li><li dir=""ltr"" style=""list-style-type: disc;"" aria-level=""1""><p dir=""ltr"" role=""presentation"">Create and onboard new benchmarks for the hardest tasks for the coding agents.&nbsp;</p></li><li dir=""ltr"" style=""list-style-type: disc;"" aria-level=""1""><p dir=""ltr"" role=""presentation"">Collaborate closely with engineering teams to productionize research, validate improvements, and accelerate model iteration cycles.</p></li><li dir=""ltr"" style=""list-style-type: disc;"" aria-level=""1""><p dir=""ltr"" role=""presentation"">Own end‑to‑end quality insights for the models behind GitHub Copilot and new AI features.</p></li><li dir=""ltr"" style=""list-style-type: disc;"" aria-level=""1""><p dir=""ltr"" role=""presentation"">Work closely with product development, engineering, and design teams to integrate advanced research findings into practical applications, ensuring alignment with product goals and user needs.</p></li></ul><h3 dir=""ltr""><span style=""font-size: 9pt;"">Influence, Mentor &amp; Lead</span></h3><ul><li dir=""ltr"" style=""list-style-type: disc;"" aria-level=""1""><p dir=""ltr"" role=""presentation"">Shape GitHub&rsquo;s strategy for model quality, alignment, and evaluation.</p></li><li dir=""ltr"" style=""list-style-type: disc;"" aria-level=""1""><p dir=""ltr"" role=""presentation"">Mentor other researchers and engineers, helping elevate technical standards across the organization.</p></li><li dir=""ltr"" style=""list-style-type: disc;"" aria-level=""1""><p dir=""ltr"" role=""presentation"">Drive clarity in ambiguous problem spaces and champion fast, high‑quality execution.</p></li></ul><p>&nbsp;</p> <br><strong>Qualifications</strong><br><br><p dir=""ltr"">&nbsp;</p><p dir=""ltr""><strong><span style=""font-size: 9pt;"">Required Qualifications</span></strong></p><ul><li dir=""ltr"" role=""presentation"">Bachelor's degree in Data Science, Mathematics, Physics, Statistics, Economics, Operations Research, Computer Science, or related field AND 8+ years' experience in data science (e.g., managing structured and unstructured data, applying statistical techniques) or related field,<ul><li dir=""ltr"" role=""presentation"">OR master's degree in Data Science, Mathematics, Physics, Statistics, Economics, Operations Research, Computer Science, or related field AND 6+ years' experience in data science (e.g., managing structured and unstructured data, applying statistical techniques) or related field,</li><li dir=""ltr"" role=""presentation"">OR doctorate in Data Science, Mathematics, Physics, Statistics, Economics, Operations Research, Computer Science, or related field AND 4+ years' experience in data science (e.g., managing structured and unstructured data, applying statistical techniques) or related field,</li><li dir=""ltr"" role=""presentation"">OR equivalent experience.</li></ul></li><li dir=""ltr"" style=""list-style-type: disc;"" aria-level=""1""><p dir=""ltr"" role=""presentation"">3+ years of strong engineering skills in Python/Typescript and experience building production grade evaluation or data/ML pipelines at scale.</p></li><li dir=""ltr"" style=""list-style-type: disc;"" aria-level=""1""><p dir=""ltr"" role=""presentation"">Proven track record shipping research or evaluation systems in production environments.</p></li><li dir=""ltr"" style=""list-style-type: disc;"" aria-level=""1""><p dir=""ltr"" role=""presentation"">Strong cross‑functional communication and influence skills.</p></li></ul><p dir=""ltr""><strong>Preferred Qualifications</strong></p><ul><li dir=""ltr"" style=""list-style-type: disc;"" aria-level=""1""><p dir=""ltr"" role=""presentation"">Experience with LLM judge systems, reward modeling, alignment, or safety evaluations.</p></li><li dir=""ltr"" style=""list-style-type: disc;"" aria-level=""1""><p dir=""ltr"" role=""presentation"">Background in code generation, developer tools, or AI‑assisted programming.</p></li><li dir=""ltr"" style=""list-style-type: disc;"" aria-level=""1""><p dir=""ltr"" role=""presentation"">Experience with large‑scale experimentation and online/offline evaluation strategies.</p></li><li dir=""ltr"" style=""list-style-type: disc;"" aria-level=""1""><p dir=""ltr"" role=""presentation"">Open‑source contributions or experience working with developer communities.</p></li><li dir=""ltr"" style=""list-style-type: disc;"" aria-level=""1""><p dir=""ltr"" role=""presentation"">Experience designing and leading complex research projects from ideation to implementation</p></li><li dir=""ltr"" style=""list-style-type: disc;"" aria-level=""1""><p dir=""ltr"" role=""presentation"">Ability to define and articulate data-driven strategies that consider cross-functional impacts and align with organizational priorities, particularly in a software development platform context</p></li></ul><p>&nbsp;</p> <br><strong>Compensation Range</strong><br><br>The base salary range for this job is USD $140,400.00 - USD $372,300.00 /Yr.<br><br>These pay ranges are intended to cover roles based across the United States. An individual's base pay depends on various factors including geographical location and review of experience, knowledge, skills, abilities of the applicant. At GitHub certain roles are eligible for benefits and additional rewards, including annual bonus and stock. These rewards are allocated based on individual impact in role. In addition, certain roles also have the opportunity to earn sales incentives based on revenue or utilization, depending on the terms of the plan and the employee's role. <p><strong>GitHub values</strong></p> <ul><li>Customer-obsessed</li> <li>Ship to learn</li> <li>Growth mindset</li> <li>Own the outcome</li> <li>Better together</li> <li>Diverse and inclusive</li></ul> <p><strong>Manager fundamentals</strong></p> <ul><li>Model</li> <li>Coach</li> <li>Care</li></ul> <p><strong>Leadership principles</strong></p> <ul><li>Create clarity</li> <li>Generate energy</li> <li>Deliver success</li></ul> <br><strong>Who We Are</strong><br><br>GitHub is the world’s leading AI-powered developer platform with 150 million developers and counting. We’re also home to the biggest open-source community on earth (and 99% of the world’s software has open-source code in its DNA). Many of the apps and programs you use every day are built on GitHub.<br> Our teams are dreamers, doers, and pioneers, leading the way in AI, driving humanitarian efforts around the globe, and even sending open source to Mars (and beyond!). At GitHub, our goal is to create the space you need to do your best work. We’re remote-first and offer competitive pay, generous learning and growth opportunities, and excellent benefits to support you, wherever you are—because we know that people flourish when they can work on their own terms.<br> Join us, and let’s change the world, together.<br> <br><strong>EEO Statement</strong><br><br>GitHub is made up of people from a wide variety of backgrounds and lifestyles. We embrace diversity and invite applications from people of all walks of life. We don't discriminate against employees or applicants based on gender identity or expression, sexual orientation, race, religion, age, national origin, citizenship, disability, pregnancy status, veteran status, or any other differences. Also, if you have a disability, please let us know if there's any way we can make the interview process better for you; we're happy to accommodate!"
github,4732,"Senior Software Engineer, Migration Tools",US Remote,https://careers-githubinc.icims.com/jobs/4732/login,"<strong>About GitHub</strong><br><br>GitHub is the world’s leading platform for agentic software development — powered by Copilot to build, scale, and deliver secure software. Over 180 million developers, including more than 90% of the Fortune 100 companies, use GitHub to collaborate, and more than 77,000 organisations have adopted GitHub Copilot.<br> <br><strong>Locations</strong><br><br>In this role you can work from Remote, United States<br> <br><strong>Overview</strong><br><br><p dir=""ltr"">We&rsquo;re building the bridges to help customers build and deliver software using GitHub, and understand how their organization is using GitHub. As a Senior Software Engineer on the Migration Tools team, you&rsquo;ll design and implement a secure, reliable, and performant platform that directly impacts developers worldwide, ensuring that migrations to GitHub are frictionless and of high fidelity. You will also be helping customers understand and improve their security posture by improving observability by contributing to GitHub&rsquo;s Audit Log system.</p><p dir=""ltr"">&nbsp;</p><p dir=""ltr"">At GitHub, you&rsquo;ll collaborate with a distributed, diverse, and passionate team of engineers and designers, delivering services that millions of developers depend on daily. In this role, you&rsquo;ll design, prototype, implement, ship, and support highly performant, inspiring experiences that enhance collaboration and productivity for developers everywhere.</p><p dir=""ltr"">&nbsp;</p><p dir=""ltr"">We&rsquo;re looking for creative problem solvers and diverse thinkers who value culture as much as customers and features. We believe how we work is just as important as what we deliver. Big vision, shared purpose, passion for quality, curiosity, dedication, and investment in fun and collaboration are what drive great results. Great products reflect the teams that build them&mdash;come join us!</p><p>&nbsp;</p> <br><strong>Responsibilities</strong><br><br><ul><li dir=""ltr"" style=""list-style-type: disc;"" aria-level=""1""><p dir=""ltr"" role=""presentation"">Own and advocate for the health and quality of the systems that the team builds, including participating in on-call rotations and responding to incidents as necessary.</p></li><li dir=""ltr"" style=""list-style-type: disc;"" aria-level=""1""><p dir=""ltr"" role=""presentation"">Design, develop and ship high-quality technical solutions that scale and interact with multiple GitHub services.</p></li><li dir=""ltr"" style=""list-style-type: disc;"" aria-level=""1""><p dir=""ltr"" role=""presentation"">Drive continued investment in the availability, security, and observability of the migration and audit log services</p></li><li dir=""ltr"" style=""list-style-type: disc;"" aria-level=""1""><p dir=""ltr"" role=""presentation"">Collaborate with cross-functional teams to define and implement innovative solutions.</p></li><li dir=""ltr"" style=""list-style-type: disc;"" aria-level=""1""><p dir=""ltr"" role=""presentation"">Provide technical leadership and code reviews to encourage the growth of others.</p></li><li dir=""ltr"" style=""list-style-type: disc;"" aria-level=""1""><p dir=""ltr"" role=""presentation"">Write design documents and proposals, guiding the service architecture at a component level.</p></li><li dir=""ltr"" style=""list-style-type: disc;"" aria-level=""1""><p dir=""ltr"" role=""presentation"">Design and implement APIs to facilitate seamless integration with other systems and services</p></li><li dir=""ltr"" style=""list-style-type: disc;"" aria-level=""1""><p dir=""ltr"" role=""presentation"">Utilize CI/CD tools to set up automated pipelines for continuous integration and delivery.</p></li><li dir=""ltr"" style=""list-style-type: disc;"" aria-level=""1""><p dir=""ltr"" role=""presentation"">Become intimately familiar with the systems you build and take pride in writing maintainable, tested code.</p></li></ul><p>&nbsp;</p> <br><strong>Qualifications</strong><br><br><p dir=""ltr"">Required Qualifications:&nbsp;</p><ul><li dir=""ltr"" style=""list-style-type: disc;"" aria-level=""1""><p dir=""ltr"" role=""presentation"">6+ years experience in Software Engineering, Computer Science, or related technical discipline with proven experience maintaining and delivering production software coding in languages including, but not limited to, C, C++, C#, Java, JavaScript, Go, Ruby, Rust, or Python&nbsp;</p><ul><li dir=""ltr"" style=""list-style-type: circle;"" aria-level=""2""><p dir=""ltr"" role=""presentation"">OR Associate&rsquo;s Degree in Computer Science, Electrical Engineering, Electronics Engineering, Math, Physics, Computer Engineering, Computer Science, or related field AND 5+ years experience in Software Engineering, Computer Science, or related technical discipline with proven experience maintaining and delivering production software coding in languages including, but not limited to, C, C++, C#, Java, JavaScript, Go, Ruby, Rust, or Python&nbsp;</p></li><li dir=""ltr"" style=""list-style-type: circle;"" aria-level=""2""><p dir=""ltr"" role=""presentation"">OR Bachelor's Degree in Computer Science, Electrical Engineering, Electronics Engineering, Math, Physics, Computer Engineering, Computer Science, or related field AND 4+ years experience in Software Engineering, Computer Science, or related technical discipline with proven experience maintaining and delivering production software coding in languages including, but not limited to, C, C++, C#, Java, JavaScript, Go, Ruby, Rust, or Python&nbsp;</p></li><li dir=""ltr"" style=""list-style-type: circle;"" aria-level=""2""><p dir=""ltr"" role=""presentation"">OR Master's Degree in Computer Science, Electrical Engineering, Electronics Engineering, Math, Physics, Computer Engineering, Computer Science, or related field AND 2+ years experience in Software Engineering, Computer Science, or related technical discipline with proven experience maintaining and delivering production software coding in languages including, but not limited to, C, C++, C#, Java, JavaScript, Go, Ruby, Rust, or Python.&nbsp;</p></li><li dir=""ltr"" style=""list-style-type: circle;"" aria-level=""2""><p dir=""ltr"" role=""presentation"">OR Doctorate in Computer Science, Electrical Engineering, Electronics Engineering, Math, Physics, Computer Engineering, Computer Science, or related field.&nbsp;</p></li><li dir=""ltr"" style=""list-style-type: circle;"" aria-level=""2""><p dir=""ltr"" role=""presentation"">OR equivalent experience&nbsp;</p></li></ul></li></ul><p dir=""ltr"">Preferred Qualifications:</p><ul><li dir=""ltr"" style=""list-style-type: disc;"" aria-level=""1""><p dir=""ltr"" role=""presentation"">Knowledge of data pipelines such as Kafka.</p></li><li dir=""ltr"" style=""list-style-type: disc;"" aria-level=""1""><p dir=""ltr"" role=""presentation"">Strong knowledge of cloud platforms (e.g. Azure, AWS, or GCP) and developing scalable applications upon them.</p></li><li dir=""ltr"" style=""list-style-type: disc;"" aria-level=""1""><p dir=""ltr"" role=""presentation"">Proven incident response experience including an ability to mitigate impact under pressure.</p></li><li dir=""ltr"" style=""list-style-type: disc;"" aria-level=""1""><p dir=""ltr"" role=""presentation"">Excellent written and verbal communication skills.</p></li><li dir=""ltr"" style=""list-style-type: disc;"" aria-level=""1""><p dir=""ltr"" role=""presentation"">Prior experience with best practices when working and communicating with a remote team.</p></li></ul><p>&nbsp;</p> <br><strong>Compensation Range</strong><br><br>The base salary range for this job is USD $124,000.00 - USD $329,200.00 /Yr.<br><br>These pay ranges are intended to cover roles based across the United States. An individual's base pay depends on various factors including geographical location and review of experience, knowledge, skills, abilities of the applicant. At GitHub certain roles are eligible for benefits and additional rewards, including annual bonus and stock. These rewards are allocated based on individual impact in role. In addition, certain roles also have the opportunity to earn sales incentives based on revenue or utilization, depending on the terms of the plan and the employee's role. <p><strong>GitHub values</strong></p> <ul><li>Customer-obsessed</li> <li>Ship to learn</li> <li>Growth mindset</li> <li>Own the outcome</li> <li>Better together</li> <li>Diverse and inclusive</li></ul> <p><strong>Manager fundamentals</strong></p> <ul><li>Model</li> <li>Coach</li> <li>Care</li></ul> <p><strong>Leadership principles</strong></p> <ul><li>Create clarity</li> <li>Generate energy</li> <li>Deliver success</li></ul> <br><strong>Who We Are</strong><br><br>GitHub is the world’s leading AI-powered developer platform with 150 million developers and counting. We’re also home to the biggest open-source community on earth (and 99% of the world’s software has open-source code in its DNA). Many of the apps and programs you use every day are built on GitHub.<br> Our teams are dreamers, doers, and pioneers, leading the way in AI, driving humanitarian efforts around the globe, and even sending open source to Mars (and beyond!). At GitHub, our goal is to create the space you need to do your best work. We’re remote-first and offer competitive pay, generous learning and growth opportunities, and excellent benefits to support you, wherever you are—because we know that people flourish when they can work on their own terms.<br> Join us, and let’s change the world, together.<br> <br><strong>EEO Statement</strong><br><br>GitHub is made up of people from a wide variety of backgrounds and lifestyles. We embrace diversity and invite applications from people of all walks of life. We don't discriminate against employees or applicants based on gender identity or expression, sexual orientation, race, religion, age, national origin, citizenship, disability, pregnancy status, veteran status, or any other differences. Also, if you have a disability, please let us know if there's any way we can make the interview process better for you; we're happy to accommodate!"
