company,id,title,location,url,notes
github,2615,Staff Software Engineer,US Remote,https://globalcareers-githubinc.icims.com/jobs/2615/login,"About GitHub As the global home for all developers, GitHub is the complete AI-powered developer platform to build, scale, and deliver secure software. Over 100 million people, including developers from 90 of the Fortune 100 companies, use GitHub to build amazing things together across 330+ million repositories. With all the collaborative features of GitHub, it has never been easier for individuals and teams to write faster, better code. Locations In this role you can work from Remote, United States Overview GitHub is the world’s leading AI-powered developer platform with 100 million developers and counting. We’re also home to the biggest open source community on earth (and 99% of the world’s software has open source code in its DNA). Many of the apps and programs you use every day are built on GitHub. Our teams are dreamers, doers, and pioneers, leading the way in AI, driving humanitarian efforts around the globe, and even sending open source to Mars (and beyond!). At GitHub, our goal is to create the space you need to do your best work. We’re remote-first and offer competitive pay, generous learning and growth opportunities, and excellent benefits to support you, wherever you are—because we know that people flourish when they can work on their own terms. Join us, and let’s change the world together. As a software engineer at GitHub, you will enhance the collaboration experience at GitHub by working closely with a community of engineers and designers with a distributed, diverse and passionate team delivering the services that millions of developers depend on. In this role you will design, prototype, implement, ship and support highly performant and inspiring user experiences with your team. We are looking for creative problem solvers and diverse thinkers, people who care about culture as well as customers and features. We believe that how we do things is as important as what we do. Big vision, a common purpose, passion for quality, curiosity, dedication, and investment in fun and collaboration are what lead to great results. Great products reflect the teams that build them Responsibilities Design, develop and ship high-quality technical solutions that scale across multiple GitHub services. Collaborate with cross-functional teams to define and implement innovative solutions. Provide technical leadership, mentorship, pairing opportunities, and code reviews to encourage the growth of others. Write architecture briefs and proposals, carry out code experiments, and build prototypes to learn how we can achieve planetary scale with our systems. Design and implement APIs to facilitate seamless integration between software components. Utilize CI/CD tools to set up automated pipelines for continuous integration and delivery. Become intimately familiar with the systems you build and take pride in writing maintainable code. Qualifications Required Qualifications: 10+ years of experience as a software engineer Experience leading a team in designing, building, scaling and maintaining distributed systems Experience leading a team in testing, production system monitoring, and observability Preferred Qualifications: Excellent written and verbal communication via async collaboration, documentation, and visibility of work Hands-on experience with distributed systems at global scale. Experience working with a remote, distributed team. Familiarity with SQL, Kusto Query Language, general database knowledge, Kubernetes, and/or cloud-native concepts Passionate about fostering effective Engineering practices and processes. Proficiency in Git and GitHub for version control and collaborative development and branching strategies. Experience with CI/CD Tools: Strong knowledge of CI/CD concepts and best practices. Experience with GitHub actions and workflows platform, familiar with other tools like Jenkins Contribute to open source software, engage with maintainers, and actively participate in community curation GitHub values Customer-obsessed Ship to learn Growth mindset Own the outcome Better together Diverse and inclusive Manager fundamentals Model Coach Care Leadership principles Create clarity Generate energy Deliver success Who We Are GitHub is the world’s leading AI-powered developer platform with 100 million developers and counting. We’re also home to the biggest open-source community on earth (and 99% of the world’s software has open-source code in its DNA). Many of the apps and programs you use every day are built on GitHub. Our teams are dreamers, doers, and pioneers, leading the way in AI, driving humanitarian efforts around the globe, and even sending open source to Mars (and beyond!). At GitHub, our goal is to create the space you need to do your best work. We’re remote-first and offer competitive pay, generous learning and growth opportunities, and excellent benefits to support you, wherever you are—because we know that people flourish when they can work on their own terms. Join us, and let’s change the world, together."
github,2630,"Senior Software Engineer, Copilot in the CLI",US Remote,https://careers-githubinc.icims.com/jobs/2630/login,"About GitHub As the global home for all developers, GitHub is the complete AI-powered developer platform to build, scale, and deliver secure software. Over 100 million people, including developers from 90 of the Fortune 100 companies, use GitHub to build amazing things together across 330+ million repositories. With all the collaborative features of GitHub, it has never been easier for individuals and teams to write faster, better code. Locations In this role you can work from Remote, United States Overview GitHub Copilot has changed the way software is built, and we have a unique opportunity to look further ahead and identify how software development can be faster, safer, easier, and more accessible. We’re looking for a talented, experienced Software Engineer to join the GitHub CLI team on this mission! GitHub CLI (gh) bridges the gap between GitHub primitives and workflows (e.g. Pull Requests, Issues, Repositories) and is a companion of git (not a replacement). With the addition of Copilot in the CLI (gh-copilot), the team is looking for someone who is passionate not only about command line interfaces but also about bringing the power of AI to further boost the productivity straight from the terminal. Come join the team and influence the future of GitHub CLI and Copilot in the CLI! Stack: GitHub CLI is built in Go and is highly integrated with GitHub's REST and GraphQL APIs. GitHub CLI is built using GitHub products and features such as GitHub Actions and GitHub Pages. Responsibilities Designing and building new features that will simplify developer workflows. Influencing product direction by participating in design and architecture discussions. Triaging community-reported issues and helping your teammates solve problems. Diving into unfamiliar codebases to debug issues. Collaborating with other GitHub teams to provide the best experience for our users Qualifications Required Qualifications: 5+ years experience as a software engineer Experience with Go Solid understanding of testing principles and high quality software Strong analytical skills and experience Preferred Qualifications: Excellent communication skills both verbal and written High degree of empathy Experience in building command line tools Experience in being a part of an open source community, especially as a maintainer Experience in working with a remote, distributed team Interest or prior experience in modern AI/machine learning technologies, LLMs, or similar Compensation Range USD $104,400.00 - USD $276,900.00 /Yr. In addition, certain roles also have the opportunity to earn sales incentives based on revenue or utilization, depending on the terms of the plan and the employee's role. These pay ranges are intended to cover roles based across the United States. An individual's base pay depends on various factors including geographical location and review of experience, knowledge, skills, abilities of the applicant. At GitHub certain roles are eligible for benefits and additional rewards, including annual bonus and stock. These rewards are allocated based on individual impact in role. In addition, certain roles also have the opportunity to earn sales incentives based on revenue or utilization, depending on the terms of the plan and the employee's role. GitHub values Customer-obsessed Ship to learn Growth mindset Own the outcome Better together Diverse and inclusive Manager fundamentals Model Coach Care Leadership principles Create clarity Generate energy Deliver success Who We Are GitHub is the world’s leading AI-powered developer platform with 100 million developers and counting. We’re also home to the biggest open-source community on earth (and 99% of the world’s software has open-source code in its DNA). Many of the apps and programs you use every day are built on GitHub. Our teams are dreamers, doers, and pioneers, leading the way in AI, driving humanitarian efforts around the globe, and even sending open source to Mars (and beyond!). At GitHub, our goal is to create the space you need to do your best work. We’re remote-first and offer competitive pay, generous learning and growth opportunities, and excellent benefits to support you, wherever you are—because we know that people flourish when they can work on their own terms. Join us, and let’s change the world, together. EEO Statement GitHub is made up of people from a wide variety of backgrounds and lifestyles. We embrace diversity and invite applications from people of all walks of life. We don't discriminate against employees or applicants based on gender identity or expression, sexual orientation, race, religion, age, national origin, citizenship, disability, pregnancy status, veteran status, or any other differences. Also, if you have a disability, please let us know if there's any way we can make the interview process better for you; we're happy to accommodate!"
github,2640,"Senior Software Engineer, Copilot Platform",Germany Remote,https://globalcareers-githubinc.icims.com/jobs/2640/login,"About GitHub As the global home for all developers, GitHub is the complete AI-powered developer platform to build, scale, and deliver secure software. Over 100 million people, including developers from 90 of the Fortune 100 companies, use GitHub to build amazing things together across 330+ million repositories. With all the collaborative features of GitHub, it has never been easier for individuals and teams to write faster, better code. Locations In this role you can work from Remote, Germany Overview GitHub Copilot has changed the way software is built, and we have a unique opportunity to look further ahead to identify how software development can be faster, safer, easier, and more accessible. We’re looking for a talented and experienced Software Engineer to join us in this mission! GitHub Copilot Platform has a crucial role in advancing the core intelligence solutions that power the Copilot features in GitHub. GitHub Copilot Foundations owns the continued global scaling of GitHub’s code completion features and the expanding feature set to continue its industry-leading position. Both teams are also focused on ensuring other engineering teams at GitHub have the tools and processes necessary to build on top of our platform with as little friction as possible. As a Senior Software Engineer on the Copilot Platform or Foundations Team, you will work closely with a distributed, diverse, and passionate team of engineers and product managers with multiple teams across GitHub and Microsoft to improve and maintain our Platform that integrators depend on in their software development cycle. Together, we are dedicated to shaping the future of software development by continuously enhancing AI-powered capabilities in GitHub and beyond. The Copilot team is highly distributed and you will thrive in an environment of remote work and asynchronous communication. You're expected to have strong written communication skills and be able to develop working relationships with coworkers in locations around the globe. As an engineer at GitHub you'll always be challenged to solve interesting and novel problems that have real impact on how the world builds software. Responsibilities Lead technical decision making and architecture Design and implement scalable, reliable and performant solutions for problems like rate-limiting, request routing, etc. Write, review, and maintain code primarily in Go Mentor other engineers in their technical and architectural decision making Qualifications Required Qualifications: A few years of experience building high traffic services at scale A few years of experience building and/or consuming REST-style APIs Experience architecting highly available, high volume APIs Preferred Qualifications: Experience with Go and related tooling Experience with distributed systems at global scale Experience working with a remote, distributed team Excellent written and verbal communication skills Interest or prior experience in modern AI/machine learning technologies, Large Language Models or similar Passionate about fostering good API Design practices and processes GitHub values Customer-obsessed Ship to learn Growth mindset Own the outcome Better together Diverse and inclusive Manager fundamentals Model Coach Care Leadership principles Create clarity Generate energy Deliver success Who We Are GitHub is the world’s leading AI-powered developer platform with 100 million developers and counting. We’re also home to the biggest open-source community on earth (and 99% of the world’s software has open-source code in its DNA). Many of the apps and programs you use every day are built on GitHub. Our teams are dreamers, doers, and pioneers, leading the way in AI, driving humanitarian efforts around the globe, and even sending open source to Mars (and beyond!). At GitHub, our goal is to create the space you need to do your best work. We’re remote-first and offer competitive pay, generous learning and growth opportunities, and excellent benefits to support you, wherever you are—because we know that people flourish when they can work on their own terms. Join us, and let’s change the world, together."
github,2645,Senior Software Engineer,Canada Remote,https://globalcareers-githubinc.icims.com/jobs/2645/login,"About GitHub As the global home for all developers, GitHub is the complete AI-powered developer platform to build, scale, and deliver secure software. Over 100 million people, including developers from 90 of the Fortune 100 companies, use GitHub to build amazing things together across 330+ million repositories. With all the collaborative features of GitHub, it has never been easier for individuals and teams to write faster, better code. Locations In this role you can work from Remote, Canada Overview GitHub is looking for a Senior Software Engineer to join the Authentication team. This team is part of Identity and Enterprise Administration (IdEA) at GitHub. We are responsible for all things authentication. We build and maintain the account login services for GitHub, protecting the integrity of user credentials, and providing means of account recovery. The ideal candidate is a team player who is comfortable working in the context of both monoliths and micro-services. They don’t shy away from hard problems, and have a strong sense of customer empathy. They are comfortable working closely with engineers at all levels as well as product managers. Responsibilities Leveraging strong OS and cryptography skills, extending existing standards that protect web-facing credentials to the OS and native app side. Work on cross-cutting projects to independently scale authentication services. Implement new and maintain existing authentication flows and management interfaces. Integrate with third party services that support authentication interfaces - Troubleshoot customer authentication issues across our product suite in an on-call rotation. Qualifications Required Qualifications 6+ years of software engineering experience 4+ years experience building high-traffic applications 4+ years experience leading a team of engineers on projects from start to finish 2+ years experience designing and building large-scale services Preferred Qualifications Experience in Go, Ruby/Rails Experience in IAM space Familiarity with 2FA/MFA, WebAuthn, SSH, PAT, Passwordless authentication concepts Familiarity with cryptography systems such as TPMs and iCloud Keychain, OAuth 2 protocols, and native app development Comfortable in delivering large ambitious projects using iterative deliverables. Strong track record of delivering projects GitHub values Customer-obsessed Ship to learn Growth mindset Own the outcome Better together Diverse and inclusive Manager fundamentals Model Coach Care Leadership principles Create clarity Generate energy Deliver success Who We Are GitHub is the world’s leading AI-powered developer platform with 100 million developers and counting. We’re also home to the biggest open-source community on earth (and 99% of the world’s software has open-source code in its DNA). Many of the apps and programs you use every day are built on GitHub. Our teams are dreamers, doers, and pioneers, leading the way in AI, driving humanitarian efforts around the globe, and even sending open source to Mars (and beyond!). At GitHub, our goal is to create the space you need to do your best work. We’re remote-first and offer competitive pay, generous learning and growth opportunities, and excellent benefits to support you, wherever you are—because we know that people flourish when they can work on their own terms. Join us, and let’s change the world, together."
github,2649,"Senior Software Engineer, CLI",United Kingdom Remote,https://globalcareers-githubinc.icims.com/jobs/2649/login,"About GitHub As the global home for all developers, GitHub is the complete AI-powered developer platform to build, scale, and deliver secure software. Over 100 million people, including developers from 90 of the Fortune 100 companies, use GitHub to build amazing things together across 330+ million repositories. With all the collaborative features of GitHub, it has never been easier for individuals and teams to write faster, better code. Locations In this role you can work from Remote, United Kingdom Overview The Client Apps organization at GitHub builds best-in-class experiences for our users to interact with Git and GitHub from whatever environment they choose. We are the small but mighty group responsible for the official GitHub CLI, GitHub Desktop, and GitHub Mobile apps. We are a product-driven organization that values building software collaboratively with our users as well as our internal partners. GitHub CLI (also known as gh) is an open source project that allows users to perform their tasks on GitHub without leaving the terminal. It has over 34K stars and is used by hundreds of thousands of developers and in many more automated workflows every day. The team is looking for a Senior Software Engineer to help influence and build the future of GitHub CLI. Stack: GitHub CLI is built in Go and is highly integrated with GitHub's REST and GraphQL APIs. GitHub CLI is built using GitHub products and features such as GitHub Actions and GitHub Pages. Responsibilities Designing and building new features that will simplify developer workflows. Influencing product direction by participating in design and architecture discussions. Triaging community-reported issues and helping your teammates solve problems. Diving into unfamiliar codebases to debug issues. Collaborating with other GitHub teams to provide the best experience for our users Qualifications Required Qualifications: Many years of experience as a software engineer Experience with Go Solid understanding of testing principles and high quality software Strong analytical skills and experience Preferred Qualifications: Excellent communication skills both verbal and written High degree of empathy Experience in building command line tools Experience in being a part of an open source community, especially as a maintainer Experience in working with a remote, distributed team GitHub values Customer-obsessed Ship to learn Growth mindset Own the outcome Better together Diverse and inclusive Manager fundamentals Model Coach Care Leadership principles Create clarity Generate energy Deliver success Who We Are GitHub is the world’s leading AI-powered developer platform with 100 million developers and counting. We’re also home to the biggest open-source community on earth (and 99% of the world’s software has open-source code in its DNA). Many of the apps and programs you use every day are built on GitHub. Our teams are dreamers, doers, and pioneers, leading the way in AI, driving humanitarian efforts around the globe, and even sending open source to Mars (and beyond!). At GitHub, our goal is to create the space you need to do your best work. We’re remote-first and offer competitive pay, generous learning and growth opportunities, and excellent benefits to support you, wherever you are—because we know that people flourish when they can work on their own terms. Join us, and let’s change the world, together."
