company,id,title,location,url,notes
github,4429,"Staff Software Engineer, Data",US Remote,https://careers-githubinc.icims.com/jobs/4429/login,"About GitHub As the global home for all developers, GitHub is the complete AI-powered developer platform to build, scale, and deliver secure software. Over 150+ million developers, including more than 90% of the Fortune 100 companies, use GitHub to collaborate and experiment across 420+ million repositories. With all the collaborative features of GitHub, it has never been easier for individuals and teams to write faster, better code. Locations In this role you can work from Remote, United States Overview As a software engineer at GitHub, you will enhance the collaboration experience at GitHub by working closely with a community of engineers and designers with a distributed, diverse and passionate team delivering the services that millions of developers depend on. In this role you will design, prototype, implement, ship and support highly performant and inspiring user experiences with your team. We are looking for creative problem solvers and diverse thinkers, people who care about culture as well as customers and features. We believe that how we do things is as important as what we do. Big vision, a common purpose, passion for quality, curiosity, dedication, and investment in fun and collaboration are what lead to great results. Great products reflect the teams that build them. Responsibilities Design, develop, test and ship high-quality technical solutions that scale across multiple GitHub services and become intimately familiar with the systems you build and take pride in writing maintainable code. Provide technical leadership, mentorship, pairing opportunities, and code reviews to encourage the growth of others; support teams in producing extensible and maintainable code, ensuring integration with downstream dependencies and adherence to quality standards. Own and advocate for the health and quality of the systems that the team builds, including participating in on-call for first responder rotations and live incidents. Write architecture briefs and proposals and carry out code experiments. Design and implement APIs to facilitate seamless integration between software components. Utilize CI/CD tools to set up automated pipelines for continuous integration and delivery. Collaborate with cross-functional teams and partner with stakeholders and lead discussions for technical solutions, including design and cost considerations. Create and guide others in 1) developing clear testing plans to assure solution quality, reliability, and performance; 2) defining success metrics; and 3) integrating customer feedback for continuous improvement - all while ensuring system architecture meets security and compliance standards. Maintain executional and operational excellence within and potentially across teams/organizations. Apply debugging tools and telemetry to verify assumptions, proactively resolve issues, and optimize code performance and maintainability. Drive and support technical roadmap that aligns with product goals, ensuring that engineering efforts are strategically prioritized and incorporating the adoption of new technologies and methodologies where applicable. Qualifications Required Qualifications: 9+ years' experience in software engineering, computer science, or related technical discipline with proven experience maintaining and delivering production software coding in languages including, but not limited to, Go, Ruby, Rust, Python, JavaScript, C, C++, C#, Java, OR associate’s degree in Computer Science, Electrical Engineering, Electronics Engineering, Math, Physics, Computer Engineering, Computer Science, or related field AND 8+ years' experience in software engineering, computer science, or related technical discipline with proven experience maintaining and delivering production software coding in languages including, but not limited to, Go, Ruby, Rust, Python, JavaScript, C, C++, C#, Java, OR bachelor's degree in Computer Science or related field AND 7+ years' experience in software engineering, computer science, or related technical discipline with proven experience maintaining and delivering production software coding in languages including, but not limited to, Go, Ruby, Rust, Python, JavaScript, C, C++, C#, Java, OR master's degree in Computer Science, Electrical Engineering, Electronics Engineering, Math, Physics, Computer Engineering, Computer Science, or related field AND 5+ years' experience in software engineering, computer science, or related technical discipline with proven experience maintaining and delivering production software coding in languages including, but not limited to, Go, Ruby, Rust, Python, JavaScript, C, C++, C#, Java, OR doctorate in Computer Science, Electrical Engineering, Electronics Engineering, Math, Physics, Computer Engineering, Computer Science, or related field AND 3+ years' experience in software engineering, computer science, or related technical discipline with proven experience maintaining and delivering production software coding in languages including, but not limited to, Go, Ruby, Rust, Python, JavaScript, C, C++, C#, Java, OR equivalent experience. Preferred Qualifications: Demonstrated experience with large-scale system architecture and design, particularly in cloud-based environments, with a strong understanding of distributed systems and microservices. Experience working closely with product management, design, and other engineering teams to drive cross-functional projects and deliver high-quality products Experience in one or more scripting languages (e.g., Bash, Python, or a similar language) Experience with cloud environments and/or Cloud Native Compute Foundation (CNCF) concepts Experience working with both relational (e.g. mysql) and most importantly non-relational datastores (e.g. Cosmos) Experience working with Azure resource such as Azure Storage (blob and table particularly), Azure Redis Cache, Azure Data Explorer Clusters. Experience operating Cosmos DB clusters at scale. Compensation Range The base salary range for this job is USD $127,600.00 - USD $338,500.00 /Yr. These pay ranges are intended to cover roles based across the United States. An individual's base pay depends on various factors including geographical location and review of experience, knowledge, skills, abilities of the applicant. At GitHub certain roles are eligible for benefits and additional rewards, including annual bonus and stock. These rewards are allocated based on individual impact in role. In addition, certain roles also have the opportunity to earn sales incentives based on revenue or utilization, depending on the terms of the plan and the employee's role. GitHub values Customer-obsessed Ship to learn Growth mindset Own the outcome Better together Diverse and inclusive Manager fundamentals Model Coach Care Leadership principles Create clarity Generate energy Deliver success Who We Are GitHub is the world’s leading AI-powered developer platform with 150 million developers and counting. We’re also home to the biggest open-source community on earth (and 99% of the world’s software has open-source code in its DNA). Many of the apps and programs you use every day are built on GitHub. Our teams are dreamers, doers, and pioneers, leading the way in AI, driving humanitarian efforts around the globe, and even sending open source to Mars (and beyond!). At GitHub, our goal is to create the space you need to do your best work. We’re remote-first and offer competitive pay, generous learning and growth opportunities, and excellent benefits to support you, wherever you are—because we know that people flourish when they can work on their own terms. Join us, and let’s change the world, together. EEO Statement GitHub is made up of people from a wide variety of backgrounds and lifestyles. We embrace diversity and invite applications from people of all walks of life. We don't discriminate against employees or applicants based on gender identity or expression, sexual orientation, race, religion, age, national origin, citizenship, disability, pregnancy status, veteran status, or any other differences. Also, if you have a disability, please let us know if there's any way we can make the interview process better for you; we're happy to accommodate!"
github,4432,"Staff Software Engineer, Performance Engineering",US Remote,https://careers-githubinc.icims.com/jobs/4432/login,"About GitHub As the global home for all developers, GitHub is the complete AI-powered developer platform to build, scale, and deliver secure software. Over 150+ million developers, including more than 90% of the Fortune 100 companies, use GitHub to collaborate and experiment across 420+ million repositories. With all the collaborative features of GitHub, it has never been easier for individuals and teams to write faster, better code. Locations In this role you can work from Remote, United States Overview Do you want to make software development a delight for the entire world? Join us at GitHub! We want you to help build and deliver the best end to end software development experience across GitHub. We’re looking for a Staff Software Engineer to join the GitHub Enterprise Server team. GHES is a self-hosted version of GitHub that provides all the features and functionality of GitHub.com but allows organizations to host it on their own infrastructure. Our customers run GHES in some of the most demanding enterprise environments in the world at scales with tens of thousands of developers, millions of repositories, and mission-critical workloads. In this role, you’ll lead the performance testing and analysis strategy for our enterprise offerings: building frameworks, designing workloads that mirror real customer usage, diagnosing bottlenecks across the stack, and working cross-functionally to ensure every release scales with our customers’ needs. If you are passionate about performance, distributed systems, and large-scale reliability and thrive on diving deep into complex systems to make them faster and more efficient we want to hear from you! Responsibilities Lead the design, development, and evolution of performance testing frameworks. Collaborate with cross-functional teams and partner with stakeholders and lead discussions for technical solutions, including design and cost considerations. Define, implement, and scale realistic workloads that capture customer usage patterns (e.g., Git, API, CI/CD). Profile and analyze performance across the full stack: application (Ruby, Go), database (MySQL), caching (Redis), job systems (Resque/Sidekiq), and orchestration layers (Nomad, containers). Partner with engineering teams to identify, reproduce, and resolve performance bottlenecks. Establish performance baselines and regression detection in CI/CD pipelines. Design experiments to evaluate system scalability, concurrency, and fault tolerance. Provide deep technical guidance and mentorship on performance methodology across the org. Collaborate with support and reliability teams to reproduce customer workloads and drive fixes upstream. Author clear technical documentation and present findings to senior leadership and customers. Create and guide others in building a performance testing roadmap for Enterprise as a whole that includes defining success metrics and integrating customer feedback for continuous improvement. Qualifications Required Qualifications: 9+ years' experience in software engineering, computer science, or related technical discipline with proven experience maintaining and delivering production software coding in languages including, but not limited to, Go, Ruby, Rust, Python, JavaScript, C, C++, C#, Java, OR associate’s degree in Computer Science, Electrical Engineering, Electronics Engineering, Math, Physics, Computer Engineering, Computer Science, or related field AND 8+ years' experience in software engineering, computer science, or related technical discipline with proven experience maintaining and delivering production software coding in languages including, but not limited to, Go, Ruby, Rust, Python, JavaScript, C, C++, C#, Java, OR bachelor's degree in Computer Science or related field AND 7+ years' experience in software engineering, computer science, or related technical discipline with proven experience maintaining and delivering production software coding in languages including, but not limited to, Go, Ruby, Rust, Python, JavaScript, C, C++, C#, Java, OR master's degree in Computer Science, Electrical Engineering, Electronics Engineering, Math, Physics, Computer Engineering, Computer Science, or related field AND 5+ years' experience in software engineering, computer science, or related technical discipline with proven experience maintaining and delivering production software coding in languages including, but not limited to, Go, Ruby, Rust, Python, JavaScript, C, C++, C#, Java, OR doctorate in Computer Science, Electrical Engineering, Electronics Engineering, Math, Physics, Computer Engineering, Computer Science, or related field AND 3+ years' experience in software engineering, computer science, or related technical discipline with proven experience maintaining and delivering production software coding in languages including, but not limited to, Go, Ruby, Rust, Python, JavaScript, C, C++, C#, Java, OR equivalent experience. 4+ years of hands-on experience in performance engineering, systems performance analysis, or equivalent work in profiling, benchmarking, and tuning distributed systems. Preferred Qualifications: Experience developing in large scale Ruby projects. Proven ability to design experiments, interpret performance data, and drive systemic performance improvements. Experience with GitHub’s technology stack (MySQL, Redis, Queuing technologies, Datadog, Nomad, Haproxy, Rails). Knowledge of observability tools (Grafana, Prometheus, Splunk, VictoriaMetrics, VictoriaLogs, etc.). Demonstrated experience with large-scale system architecture and design, particularly in cloud-based environments, with a strong understanding of distributed systems and microservices. Experience working closely with product management, design, and other engineering teams to drive cross-functional projects and deliver high-quality products Compensation Range The base salary range for this job is USD $127,600.00 - USD $338,500.00 /Yr. These pay ranges are intended to cover roles based across the United States. An individual's base pay depends on various factors including geographical location and review of experience, knowledge, skills, abilities of the applicant. At GitHub certain roles are eligible for benefits and additional rewards, including annual bonus and stock. These rewards are allocated based on individual impact in role. In addition, certain roles also have the opportunity to earn sales incentives based on revenue or utilization, depending on the terms of the plan and the employee's role. GitHub values Customer-obsessed Ship to learn Growth mindset Own the outcome Better together Diverse and inclusive Manager fundamentals Model Coach Care Leadership principles Create clarity Generate energy Deliver success Who We Are GitHub is the world’s leading AI-powered developer platform with 150 million developers and counting. We’re also home to the biggest open-source community on earth (and 99% of the world’s software has open-source code in its DNA). Many of the apps and programs you use every day are built on GitHub. Our teams are dreamers, doers, and pioneers, leading the way in AI, driving humanitarian efforts around the globe, and even sending open source to Mars (and beyond!). At GitHub, our goal is to create the space you need to do your best work. We’re remote-first and offer competitive pay, generous learning and growth opportunities, and excellent benefits to support you, wherever you are—because we know that people flourish when they can work on their own terms. Join us, and let’s change the world, together. EEO Statement GitHub is made up of people from a wide variety of backgrounds and lifestyles. We embrace diversity and invite applications from people of all walks of life. We don't discriminate against employees or applicants based on gender identity or expression, sexual orientation, race, religion, age, national origin, citizenship, disability, pregnancy status, veteran status, or any other differences. Also, if you have a disability, please let us know if there's any way we can make the interview process better for you; we're happy to accommodate!"
github,4444,"Software Engineer III, Projects",US Remote,https://careers-githubinc.icims.com/jobs/4444/login,"About GitHub As the global home for all developers, GitHub is the complete AI-powered developer platform to build, scale, and deliver secure software. Over 150+ million developers, including more than 90% of the Fortune 100 companies, use GitHub to collaborate and experiment across 420+ million repositories. With all the collaborative features of GitHub, it has never been easier for individuals and teams to write faster, better code. Locations In this role you can work from Remote, United States Overview GitHub Projects is building the future of team collaboration on software projects. Teams often face challenges in communicating and organizing work effectively. Our goal is to improve the software development lifecycle by creating tools that teams love to use. We are committed to fostering an environment where our employees can do the best work of their careers. As part of this team, you’ll collaborate across functions and teams to deliver industry-leading tools that empower developers and organizations. In this role, you’ll work as an engineer on a distributed, diverse, and passionate team, where independence and a drive for results are essential. You’ll design, implement, roll out, and support highly performant, scalable, and available features alongside talented software engineering professionals. We’re looking for creative problem-solvers and diverse thinkers who are passionate about helping teams work better together. Big vision, shared purpose, commitment to quality, curiosity, and a collaborative spirit drive our success. We embrace pair or mob programming but also lean on asynchronous communication to ensure that everyone can contribute in a way that works for them. Great products reflect the teams that build them—come join us! Responsibilities Stay current with emerging technologies, security standards, and best practices to ensure high-quality software development. You will primarily be working in TypeScript (React) and Ruby. Experience with GraphQL, Elasticsearch, and MySQL is a plus. Collaborate with stakeholders to understand requirements and incorporate feedback into designs and solutions. Design and implement scalable, secure, and reliable features, considering performance, availability, and compliance requirements. Write clean, maintainable, and extensible code following best practices; participate in code reviews to ensure quality. Debug and resolve issues proactively using telemetry, logs, and root cause analysis. Contribute to project planning by estimating work, identifying dependencies, and supporting safe deployments. Monitor and maintain live services, responding to incidents within defined SLAs and improving system health through telemetry and scorecards. Support continuous improvement through instrumentation, automation, and process enhancements for reliability and efficiency. Qualifications Required Qualifications 4+ years experience in Software Engineering, Computer Science, or related technical discipline with proven experience maintaining and delivering production software languages including, but not limited to, C, C++, C#, JavaScript, Go, Ruby, Rust, or Python OR Associate’s Degree in Computer Science, Electrical Engineering, Electronics Engineering, Math, Physics, Computer Engineering, Computer Science, or related field AND 3+ years experience OR Bachelor's Degree in Computer Science, Electrical Engineering, Electronics Engineering, Math, Physics, Computer Engineering, Computer Science, or related field AND 2+ years experience in Computer Science, or related technical discipline with proven experience coding in languages including, but not limited to, C, C++, C#, JavaScript, Go, Ruby, Rust, or Python OR Master's Degree in Computer Science, Electrical Engineering, Electronics Engineering, Math, Physics, Computer Engineering, Computer Science, or related field OR equivalent experience Preferred Qualifications Strong familiarity with TypeScript and React including the ecosystem of tools including testing and state management. Solid understanding of testing principles and high quality software Experience with Elasticsearch or equivalent search technology A passion for and understanding of accessibility Experience with Ruby on Rails or other web frameworks Compensation Range The base salary range for this job is USD $97,900.00 - USD $259,900.00 /Yr. These pay ranges are intended to cover roles based across the United States. An individual's base pay depends on various factors including geographical location and review of experience, knowledge, skills, abilities of the applicant. At GitHub certain roles are eligible for benefits and additional rewards, including annual bonus and stock. These rewards are allocated based on individual impact in role. In addition, certain roles also have the opportunity to earn sales incentives based on revenue or utilization, depending on the terms of the plan and the employee's role. GitHub values Customer-obsessed Ship to learn Growth mindset Own the outcome Better together Diverse and inclusive Manager fundamentals Model Coach Care Leadership principles Create clarity Generate energy Deliver success Who We Are GitHub is the world’s leading AI-powered developer platform with 150 million developers and counting. We’re also home to the biggest open-source community on earth (and 99% of the world’s software has open-source code in its DNA). Many of the apps and programs you use every day are built on GitHub. Our teams are dreamers, doers, and pioneers, leading the way in AI, driving humanitarian efforts around the globe, and even sending open source to Mars (and beyond!). At GitHub, our goal is to create the space you need to do your best work. We’re remote-first and offer competitive pay, generous learning and growth opportunities, and excellent benefits to support you, wherever you are—because we know that people flourish when they can work on their own terms. Join us, and let’s change the world, together. EEO Statement GitHub is made up of people from a wide variety of backgrounds and lifestyles. We embrace diversity and invite applications from people of all walks of life. We don't discriminate against employees or applicants based on gender identity or expression, sexual orientation, race, religion, age, national origin, citizenship, disability, pregnancy status, veteran status, or any other differences. Also, if you have a disability, please let us know if there's any way we can make the interview process better for you; we're happy to accommodate!"
