company,id,title,location,url,notes
cookpad,-,-,-,-,0 jobs found
fly,platform-machines,Platform Engineer: Fly Machines,US and Canada only,https://fly.io/jobs/platform-machines/,""
github,4881,"Sr. Dir, Technical Program Management",US Remote,https://careers-githubinc.icims.com/jobs/4881/login,"<strong>About GitHub</strong><br><br>GitHub is the world’s leading platform for agentic software development — powered by Copilot to build, scale, and deliver secure software. Over 180 million developers, including more than 90% of the Fortune 100 companies, use GitHub to collaborate, and more than 77,000 organisations have adopted GitHub Copilot.<br> <br><strong>Locations</strong><br><br>In this role you can work from Remote, United States<br> <br><strong>Overview</strong><br><br><p>Do you want to lead a team of Technical Program Managers as they run programs and initiatives<strong> </strong>that directly impact GitHub’s most critical goals? GitHub is looking for a senior leader to join our Technical Program Management team in our Engineering organization as a people manager. You should be an ambitious, passionate, technical, and collaborative leader, with a strong background in empowering high performing teams and an ability to deliver results through technical programs.</p> <br><strong>Responsibilities</strong><br><br><p dir=""ltr"">Opportunity and Solutions Identification</p><p dir=""ltr""> </p><ul><li dir=""ltr"" style=""list-style-type: disc;"" aria-level=""1""><p dir=""ltr"" role=""presentation"">Demonstrates and builds experiences across multiple groups or divisions. Leads and coaches teams to develop problem statements and form hypotheses for products and services across divisional boundaries to address highly complex business, program, customer needs, and/or market opportunities; identifies dependencies of other features.</p></li><li dir=""ltr"" style=""list-style-type: disc;"" aria-level=""1""><p dir=""ltr"" role=""presentation"">Determines and leads process improvements to quickly scope insights, and drives change management initiatives. Uses industry understanding to direct teams to ensure alignment between the customer, the market, internal stakeholders, senior leadership, and the goals and strategy of GitHub.</p></li><li dir=""ltr"" style=""list-style-type: disc;"" aria-level=""1""><p dir=""ltr"" role=""presentation"">Holds teams accountable for collaborating with others (e.g., Engineering, Marketing, Design) to ensure that they can satisfy customer requirements. Provides expertise to help teams validate the market size and opportunity of greatest value for the company. Facilitates collaboration between their team and other partner teams to bring about solutions.</p></li></ul><p dir=""ltr""> </p><p dir=""ltr"">Program Planning and Success</p><p dir=""ltr""> </p><ul><li dir=""ltr"" style=""list-style-type: disc;"" aria-level=""1""><p dir=""ltr"" role=""presentation"">Provides expertise to help teams define the multiple program goals and prioritization for the products and services they own. Guides teams to translate the needs of the organization and other teams into program goals and prioritize deliverables based on data insights. </p></li><li dir=""ltr"" style=""list-style-type: disc;"" aria-level=""1""><p dir=""ltr"" role=""presentation"">Guides teams to engage in active risk management (proactive and reactive) to identify risks and propose mitigations for risks using data (e.g., telemetry, usage, net satisfaction, customer satisfaction).</p></li><li dir=""ltr"" style=""list-style-type: disc;"" aria-level=""1""><p dir=""ltr"" role=""presentation"">Coaches teams to define success criteria and performance metrics (e.g., Objectives and Key Results [OKRs], Key Performance Indicators [KPIs] such as quality and performance) of products, services and works with engineering to ensure needed telemetry is developed. Provides expert knowledge to help teams deeply understand the return on investment.</p></li></ul><p dir=""ltr""> </p><p dir=""ltr"">Program/Service Development</p><p dir=""ltr""> </p><ul><li dir=""ltr"" style=""list-style-type: disc;"" aria-level=""1""><p dir=""ltr"" role=""presentation"">Acts as a subject matter expert in orchestrating and integrating efforts for the development and implementation process of product, services on large cross functional projects with internal teams and external partners. Drives teams to collaborate and coordinate across teams and perspectives to ensure alignment on product management and release, including tradeoffs, adjustments, and improvements as feasible.</p></li><li dir=""ltr"" style=""list-style-type: disc;"" aria-level=""1""><p dir=""ltr"" role=""presentation"">Guides teams to partner with the engineering team to contribute, prioritize, and deliver on the roadmap for product, service. Drives teams to understand the value proposition for the feature(s)/feature areas and answer technical questions on the feature(s)/feature areas they own. </p></li><li dir=""ltr"" style=""list-style-type: disc;"" aria-level=""1""><p dir=""ltr"" role=""presentation"">Guides teams to justify capacity requirements and advocate for the right resource allocation. Partners with the Engineering team to know the feature capabilities in alignment with the goal updates and associated tradeoffs.</p></li><li dir=""ltr"" style=""list-style-type: disc;"" aria-level=""1""><p dir=""ltr"" role=""presentation"">Guides teams tracking, coordinating, and communicating end-to-end project schedules for products, services. Ensures teams establish and monitor processes, and hold other stakeholders accountable for following the established schedule and processes.</p></li><li dir=""ltr"" style=""list-style-type: disc;"" aria-level=""1""><p dir=""ltr"" role=""presentation"">Guides teams when tracking and managing dependencies to enable cohesive, connected user scenarios, and to avoid issues and mitigate risks. Coaches teams to make adjustments or course corrections when projects are not aligned to schedules or goals.</p></li><li dir=""ltr"" style=""list-style-type: disc;"" aria-level=""1""><p dir=""ltr"" role=""presentation"">Drives teams to develop the staging and implementation plan for piloting/release in alignment with Objectives and Key Results (OKRs) and Key Performance Indicators (KPIs) for products, services, its development timeline, and the introduction to the different programs. Ensures teams collaborate with stakeholders to monitor progress and adjust as needed.</p></li><li dir=""ltr"" style=""list-style-type: disc;"" aria-level=""1""><p dir=""ltr"" role=""presentation"">Helps teams lead governance programs and processes to ensure that specific performance requirements and standards are met throughout the development lifecycle (e.g., quality, compliance, privacy, security, safety, accessibility).</p></li></ul><p dir=""ltr""> </p><p dir=""ltr"">Continuous Improvement</p><p dir=""ltr""> </p><ul><li dir=""ltr"" style=""list-style-type: disc;"" aria-level=""1""><p dir=""ltr"" role=""presentation"">Provides expertise to help teams partner with others to collect performance metrics (e.g., Key Performance Indicators [KPIs] such as usage, quality, speed, and cost), monitor and report on progress (e.g., business reviews), and derive insights that lead to productive courses of action.</p></li><li dir=""ltr"" style=""list-style-type: disc;"" aria-level=""1""><p dir=""ltr"" role=""presentation"">Ensures teams share insights with Engineering and other partners. Leads teams to form hypotheses to technical needs, perform experiments, and iterate to drive improvement in specific performance metrics that have measurable impact.</p></li></ul><p> </p> <br><strong>Qualifications</strong><br><br><p dir=""ltr""><span style=""font-size: 9pt;""><strong>Required/Minimum Qualifications</strong></span></p><p><span style=""font-size: 9pt;""><strong> </strong></span></p><p><span style=""font-size: 9pt;"">● 10+ years experience in engineering, product/technical program management, data analysis, or product development</span></p><ul><li style=""list-style-type: none;""><ul><li dir=""ltr""><span style=""font-size: 9pt;"">OR Bachelor's Degree in Computer Science, Engineering, Data Science, Math, Business, or related field AND 8+ years experience in engineering, product/technical program management, data analysis, or product development</span></li><li dir=""ltr""><span style=""font-size: 9pt;"">OR Master's Degree in Computer Science, Engineering, Data Science, Math, Business, or related field AND 6+ years experience in engineering, product/technical program management, data analysis, or product development </span></li><li dir=""ltr""><span style=""font-size: 9pt;"">OR equivalent experience. </span></li></ul></li></ul><p><span style=""font-size: 9pt;""><strong> </strong></span></p><p dir=""ltr""><span style=""font-size: 9pt;"">● 8+ years experience in managing cross-functional and/or cross-team projects.</span></p><p> </p> <br><strong>Compensation Range</strong><br><br>The base salary range for this job is USD $160,200.00 - USD $425,000.00 /Yr.<br><br>These pay ranges are intended to cover roles based across the United States. An individual's base pay depends on various factors including geographical location and review of experience, knowledge, skills, abilities of the applicant. At GitHub certain roles are eligible for benefits and additional rewards, including annual bonus and stock. These rewards are allocated based on individual impact in role. In addition, certain roles also have the opportunity to earn sales incentives based on revenue or utilization, depending on the terms of the plan and the employee's role. <p><strong>GitHub values</strong></p> <ul><li>Customer-obsessed</li> <li>Ship to learn</li> <li>Growth mindset</li> <li>Own the outcome</li> <li>Better together</li> <li>Diverse and inclusive</li></ul> <p><strong>Manager fundamentals</strong></p> <ul><li>Model</li> <li>Coach</li> <li>Care</li></ul> <p><strong>Leadership principles</strong></p> <ul><li>Create clarity</li> <li>Generate energy</li> <li>Deliver success</li></ul> <br><strong>Who We Are</strong><br><br>GitHub is the world’s leading AI-powered developer platform with 150 million developers and counting. We’re also home to the biggest open-source community on earth (and 99% of the world’s software has open-source code in its DNA). Many of the apps and programs you use every day are built on GitHub.<br> Our teams are dreamers, doers, and pioneers, leading the way in AI, driving humanitarian efforts around the globe, and even sending open source to Mars (and beyond!). At GitHub, our goal is to create the space you need to do your best work. We’re remote-first and offer competitive pay, generous learning and growth opportunities, and excellent benefits to support you, wherever you are—because we know that people flourish when they can work on their own terms.<br> Join us, and let’s change the world, together.<br> <br><strong>EEO Statement</strong><br><br>GitHub is made up of people from a wide variety of backgrounds and lifestyles. We embrace diversity and invite applications from people of all walks of life. We don't discriminate against employees or applicants based on gender identity or expression, sexual orientation, race, religion, age, national origin, citizenship, disability, pregnancy status, veteran status, or any other differences. Also, if you have a disability, please let us know if there's any way we can make the interview process better for you; we're happy to accommodate!"
