company,id,title,location,url,notes
cookpad,-,-,-,-,0 jobs found
fly,platform-machines,Platform Engineer: Fly Machines,UTC-7 to UTC-4,https://fly.io/jobs/platform-machines/,""
fly,support-engineer,Platform Engineer: Fly Machines,UTC-7 to UTC-4,https://fly.io/jobs/support-engineer/,""
github,5101,Principal Software Engineer,US Remote,https://careers-githubinc.icims.com/jobs/5101/login,"<strong>About GitHub</strong><br><br>GitHub is the world’s leading platform for agentic software development — powered by Copilot to build, scale, and deliver secure software. Over 180 million developers, including more than 90% of the Fortune 100 companies, use GitHub to collaborate, and more than 77,000 organisations have adopted GitHub Copilot.<br> <br><strong>Locations</strong><br><br>In this role you can work from Remote, United States<br> <br><strong>Overview</strong><br><br><div><p><span xml:lang=""EN-US"" data-contrast=""auto"">GitHub is seeking a Principal Software Engineer to help shape the future of our core platform infrastructure. In this critical leadership position, you'll drive system architecture for our most critical services, inspire and coach engineering teams, and deliver solutions that keep GitHub running for millions of developers worldwide.</span><span data-ccp-props=""{""134233117"":false,""134233118"":false,""335559738"":0,""335559739"":240}""> </span></p></div><div><p><span xml:lang=""EN-US"" data-contrast=""auto"">We're looking for someone with deep expertise in building and operating large-scale distributed systems—someone who thrives on solving hard problems around reliability, availability, and performance at massive scale. You have a proven track record of tackling complex technical challenges with creativity and pragmatism, and you excel in highly collaborative, cross-functional environments.</span><span data-ccp-props=""{""134233117"":false,""134233118"":false,""335559738"":240,""335559739"":240}""> </span></p></div><div><p><span xml:lang=""EN-US"" data-contrast=""auto"">Our team focuses on the systems that power GitHub at scale, ensuring our platforms remain stable, secure, and performant under extreme load. As a Principal Software Engineer, you'll work alongside a globally distributed team of talented engineers and managers to enhance and scale our most critical infrastructure, delivering an exceptional experience to our diverse and growing customer base.</span><span data-ccp-props=""{""134233117"":false,""134233118"":false,""335559738"":240,""335559739"":240}""> </span></p></div><div><p><span xml:lang=""EN-US"" data-contrast=""auto"">You'll lead by example—both through your own technical contributions and by mentoring others. You'll guide technical strategy, influence architectural decisions, and drive performance optimization across teams. Our culture is built on developer empathy, transparency, and inclusive collaboration. Here, curiosity and a drive for impact are at the heart of everything we do.</span><span data-ccp-props=""{""134233117"":false,""134233118"":false,""335559738"":240,""335559739"":240}""> </span></p></div><div><p><span xml:lang=""EN-US"" data-contrast=""auto"">Join us to help shape the future of software development and make a difference for millions of developers around the world.</span><span data-ccp-props=""{""134233117"":false,""134233118"":false,""335559738"":240,""335559739"":240}""> </span></p></div> <br><strong>Responsibilities</strong><br><br><div><ul style=""list-style-type: disc;"" role=""list""><li role=""listitem"" aria-setsize=""-1"" data-leveltext="""" data-font=""Symbol"" data-listid=""5"" data-list-defn-props=""{""335552541"":1,""335559685"":720,""335559991"":360,""469769226"":""Symbol"",""469769242"":[8226],""469777803"":""left"",""469777804"":"""",""469777815"":""hybridMultilevel""}"" data-aria-posinset=""1"" data-aria-level=""1""><p><span xml:lang=""EN-US"" data-contrast=""auto"">Lead and influence system architecture design for complex products and solutions, ensuring they meet security, compliance, and performance requirements.</span></p></li><li role=""listitem"" aria-setsize=""-1"" data-leveltext="""" data-font=""Symbol"" data-listid=""5"" data-list-defn-props=""{""335552541"":1,""335559685"":720,""335559991"":360,""469769226"":""Symbol"",""469769242"":[8226],""469777803"":""left"",""469777804"":"""",""469777815"":""hybridMultilevel""}"" data-aria-posinset=""1"" data-aria-level=""1""><p><span xml:lang=""EN-US"" data-contrast=""auto"">Establish and mentor best practices for testing, performance tuning, and code quality, defining success metrics and ensuring maintainability across dependencies.</span></p></li><li role=""listitem"" aria-setsize=""-1"" data-leveltext="""" data-font=""Symbol"" data-listid=""5"" data-list-defn-props=""{""335552541"":1,""335559685"":720,""335559991"":360,""469769226"":""Symbol"",""469769242"":[8226],""469777803"":""left"",""469777804"":"""",""469777815"":""hybridMultilevel""}"" data-aria-posinset=""1"" data-aria-level=""1""><span xml:lang=""EN-US"" data-contrast=""auto"">Provide technical leadership during code reviews to ensure reliability, scalability, and alignment with product goals.</span></li><li role=""listitem"" aria-setsize=""-1"" data-leveltext="""" data-font=""Symbol"" data-listid=""5"" data-list-defn-props=""{""335552541"":1,""335559685"":720,""335559991"":360,""469769226"":""Symbol"",""469769242"":[8226],""469777803"":""left"",""469777804"":"""",""469777815"":""hybridMultilevel""}"" data-aria-posinset=""1"" data-aria-level=""1"">Partner with product managers and technical leads to define service requirements and incorporate feedback into future designs.</li><li role=""listitem"" aria-setsize=""-1"" data-leveltext="""" data-font=""Symbol"" data-listid=""5"" data-list-defn-props=""{""335552541"":1,""335559685"":720,""335559991"":360,""469769226"":""Symbol"",""469769242"":[8226],""469777803"":""left"",""469777804"":"""",""469777815"":""hybridMultilevel""}"" data-aria-posinset=""1"" data-aria-level=""1"">Act as an expert in debugging tools and methods, leading proactive and reactive development to resolve issues across teams.</li><li role=""listitem"" aria-setsize=""-1"" data-leveltext="""" data-font=""Symbol"" data-listid=""5"" data-list-defn-props=""{""335552541"":1,""335559685"":720,""335559991"":360,""469769226"":""Symbol"",""469769242"":[8226],""469777803"":""left"",""469777804"":"""",""469777815"":""hybridMultilevel""}"" data-aria-posinset=""1"" data-aria-level=""1"">Optimize deployments and runtime performance to meet business objectives, ensuring safe rollouts aligned with GitHub's standards.</li><li role=""listitem"" aria-setsize=""-1"" data-leveltext="""" data-font=""Symbol"" data-listid=""5"" data-list-defn-props=""{""335552541"":1,""335559685"":720,""335559991"":360,""469769226"":""Symbol"",""469769242"":[8226],""469777803"":""left"",""469777804"":"""",""469777815"":""hybridMultilevel""}"" data-aria-posinset=""1"" data-aria-level=""1"">Drive improvements in development quality and team performance through tooling, automation, and knowledge sharing.</li><li role=""listitem"" aria-setsize=""-1"" data-leveltext="""" data-font=""Symbol"" data-listid=""5"" data-list-defn-props=""{""335552541"":1,""335559685"":720,""335559991"":360,""469769226"":""Symbol"",""469769242"":[8226],""469777803"":""left"",""469777804"":"""",""469777815"":""hybridMultilevel""}"" data-aria-posinset=""1"" data-aria-level=""1"">Lead product refinement through telemetry analysis, performance metrics, and experimentation frameworks to inform engineering decisions.</li><li role=""listitem"" aria-setsize=""-1"" data-leveltext="""" data-font=""Symbol"" data-listid=""5"" data-list-defn-props=""{""335552541"":1,""335559685"":720,""335559991"":360,""469769226"":""Symbol"",""469769242"":[8226],""469777803"":""left"",""469777804"":"""",""469777815"":""hybridMultilevel""}"" data-aria-posinset=""1"" data-aria-level=""1"">Develop strategies to identify and mitigate technical risks, including frameworks for risk assessment and contingency planning.</li><li role=""listitem"" aria-setsize=""-1"" data-leveltext="""" data-font=""Symbol"" data-listid=""5"" data-list-defn-props=""{""335552541"":1,""335559685"":720,""335559991"":360,""469769226"":""Symbol"",""469769242"":[8226],""469777803"":""left"",""469777804"":"""",""469777815"":""hybridMultilevel""}"" data-aria-posinset=""1"" data-aria-level=""1"">Shape the strategic vision for technology and product development, identifying opportunities for innovation and leading initiatives aligned with GitHub's long-term goals.<span data-ccp-props=""{""134233117"":false,""134233118"":false,""335559738"":0,""335559739"":0}""> </span></li></ul></div> <br><strong>Qualifications</strong><br><br><div><div><p><span xml:lang=""EN-US"" data-contrast=""none"">Required Qualifications:</span><span data-ccp-props=""{""134233117"":false,""134233118"":false,""335559738"":0,""335559739"":0}""> </span></p></div><div><p><span data-ccp-props=""{""134233117"":false,""134233118"":false,""335559738"":0,""335559739"":0}""> </span></p></div><div><ul role=""list""><li role=""listitem"" aria-setsize=""-1"" data-leveltext="""" data-font=""Symbol"" data-listid=""2"" data-list-defn-props=""{""335552541"":1,""335559685"":720,""335559991"":360,""469769226"":""Symbol"",""469769242"":[8226],""469777803"":""left"",""469777804"":"""",""469777815"":""hybridMultilevel""}"" data-aria-posinset=""1"" data-aria-level=""1""><p><span xml:lang=""EN-US"" data-contrast=""none"">11+ years experience in Software Engineering, Computer Science, or related technical discipline with proven experience maintaining and delivering production software coding in languages including, but not limited to, C, C++, C#, Java, JavaScript, Go, Ruby, Rust, or Python,</span></p><ul role=""list""><li role=""listitem"" aria-setsize=""-1"" data-leveltext="""" data-font=""Symbol"" data-listid=""2"" data-list-defn-props=""{""335552541"":1,""335559685"":720,""335559991"":360,""469769226"":""Symbol"",""469769242"":[8226],""469777803"":""left"",""469777804"":"""",""469777815"":""hybridMultilevel""}"" data-aria-posinset=""1"" data-aria-level=""1""><p><span xml:lang=""EN-US"" data-contrast=""none"">OR Associate’s Degree in Computer Science, Electrical Engineering, Electronics Engineering, Math, Physics, Computer Engineering, Computer Science, or related field AND 10+ years experience in Software Engineering, Computer Science, or related technical discipline with proven experience maintaining and delivering production software coding in languages including, but not limited to, C, C++, C#, Java, JavaScript, Go, Ruby, Rust, or Python,</span></p></li><li role=""listitem"" aria-setsize=""-1"" data-leveltext="""" data-font=""Symbol"" data-listid=""2"" data-list-defn-props=""{""335552541"":1,""335559685"":720,""335559991"":360,""469769226"":""Symbol"",""469769242"":[8226],""469777803"":""left"",""469777804"":"""",""469777815"":""hybridMultilevel""}"" data-aria-posinset=""1"" data-aria-level=""1""><p><span xml:lang=""EN-US"" data-contrast=""none"">OR Bachelor's Degree in Computer Science or related field AND 9+ years experience in Software Engineering, Computer Science, or related technical discipline with proven experience maintaining and delivering production software coding in languages including, but not limited to, C, C++, C#, Java, JavaScript, Go, Ruby, Rust, or Python,</span></p></li><li role=""listitem"" aria-setsize=""-1"" data-leveltext="""" data-font=""Symbol"" data-listid=""2"" data-list-defn-props=""{""335552541"":1,""335559685"":720,""335559991"":360,""469769226"":""Symbol"",""469769242"":[8226],""469777803"":""left"",""469777804"":"""",""469777815"":""hybridMultilevel""}"" data-aria-posinset=""1"" data-aria-level=""1""><p><span xml:lang=""EN-US"" data-contrast=""none"">OR Master's Degree in Computer Science, Electrical Engineering, Electronics Engineering, Math, Physics, Computer Engineering, Computer Science, or related field AND 7+ years experience in Software Engineering, Computer Science, or related technical discipline with proven experience maintaining and delivering production software coding in languages including, but not limited to, C, C++, C#, Java, JavaScript, Go, Ruby, Rust, or Python,</span></p></li><li role=""listitem"" aria-setsize=""-1"" data-leveltext="""" data-font=""Symbol"" data-listid=""2"" data-list-defn-props=""{""335552541"":1,""335559685"":720,""335559991"":360,""469769226"":""Symbol"",""469769242"":[8226],""469777803"":""left"",""469777804"":"""",""469777815"":""hybridMultilevel""}"" data-aria-posinset=""1"" data-aria-level=""1""><p><span xml:lang=""EN-US"" data-contrast=""none"">OR PhD Degree in Computer Science, Electrical Engineering, Electronics Engineering, Math, Physics, Computer Engineering, Computer Science, or related field AND 5+ years experience in Software Engineering, Computer Science, or related technical discipline with proven experience maintaining and delivering production software coding in languages including, but not limited to, C, C++, C#, Java, JavaScript, Go, Ruby, Rust, or Python,</span></p></li><li role=""listitem"" aria-setsize=""-1"" data-leveltext="""" data-font=""Symbol"" data-listid=""2"" data-list-defn-props=""{""335552541"":1,""335559685"":720,""335559991"":360,""469769226"":""Symbol"",""469769242"":[8226],""469777803"":""left"",""469777804"":"""",""469777815"":""hybridMultilevel""}"" data-aria-posinset=""1"" data-aria-level=""1""><p><span xml:lang=""EN-US"" data-contrast=""none"">OR equivalent experience.</span> </p></li></ul></li></ul></div></div><div><div><p><span data-ccp-props=""{""134233117"":false,""134233118"":false,""335559738"":0,""335559739"":0}""> </span></p></div><div><p><strong><span xml:lang=""EN-US"" data-contrast=""none"">Preferred Qualifications:</span> </strong></p></div><div><ul style=""list-style-type: disc;"" role=""list""><li role=""listitem"" aria-setsize=""-1"" data-leveltext="""" data-font=""Symbol"" data-listid=""4"" data-list-defn-props=""{""335552541"":1,""335559685"":720,""335559991"":360,""469769226"":""Symbol"",""469769242"":[8226],""469777803"":""left"",""469777804"":"""",""469777815"":""hybridMultilevel""}"" data-aria-posinset=""1"" data-aria-level=""1""><p><span xml:lang=""EN-US"" data-contrast=""none"">Experience with cloud platforms like Microsoft Azure and Amazon Web Services</span></p></li><li role=""listitem"" aria-setsize=""-1"" data-leveltext="""" data-font=""Symbol"" data-listid=""4"" data-list-defn-props=""{""335552541"":1,""335559685"":720,""335559991"":360,""469769226"":""Symbol"",""469769242"":[8226],""469777803"":""left"",""469777804"":"""",""469777815"":""hybridMultilevel""}"" data-aria-posinset=""1"" data-aria-level=""1""><p><span xml:lang=""EN-US"" data-contrast=""none"">Understanding of production system monitoring and observability</span></p></li><li role=""listitem"" aria-setsize=""-1"" data-leveltext="""" data-font=""Symbol"" data-listid=""4"" data-list-defn-props=""{""335552541"":1,""335559685"":720,""335559991"":360,""469769226"":""Symbol"",""469769242"":[8226],""469777803"":""left"",""469777804"":"""",""469777815"":""hybridMultilevel""}"" data-aria-posinset=""1"" data-aria-level=""1""><p><span xml:lang=""EN-US"" data-contrast=""none"">Ability to think critically about both system design and software engineering concepts and blend those perspectives pragmatically based on project needs</span></p></li><li role=""listitem"" aria-setsize=""-1"" data-leveltext="""" data-font=""Symbol"" data-listid=""4"" data-list-defn-props=""{""335552541"":1,""335559685"":720,""335559991"":360,""469769226"":""Symbol"",""469769242"":[8226],""469777803"":""left"",""469777804"":"""",""469777815"":""hybridMultilevel""}"" data-aria-posinset=""1"" data-aria-level=""1""><p><span xml:lang=""EN-US"" data-contrast=""none"">Demonstrated experience with large-scale system architecture and design, particularly in cloud-based environments, with a strong understanding of distributed systems and microservices</span></p></li><li role=""listitem"" aria-setsize=""-1"" data-leveltext="""" data-font=""Symbol"" data-listid=""4"" data-list-defn-props=""{""335552541"":1,""335559685"":720,""335559991"":360,""469769226"":""Symbol"",""469769242"":[8226],""469777803"":""left"",""469777804"":"""",""469777815"":""hybridMultilevel""}"" data-aria-posinset=""1"" data-aria-level=""1""><p><span xml:lang=""EN-US"" data-contrast=""none"">Experience working closely with product management, design, and other engineering teams to drive cross-functional projects and deliver high-quality product</span><span data-ccp-props=""{""134233117"":false,""134233118"":false,""335559738"":0,""335559739"":0}""> </span></p></li></ul></div></div> <br><strong>Compensation Range</strong><br><br>The base salary range for this job is USD $160,200.00 - USD $425,000.00 /Yr.<br><br>These pay ranges are intended to cover roles based across the United States. An individual's base pay depends on various factors including geographical location and review of experience, knowledge, skills, abilities of the applicant. At GitHub certain roles are eligible for benefits and additional rewards, including annual bonus and stock. These rewards are allocated based on individual impact in role. In addition, certain roles also have the opportunity to earn sales incentives based on revenue or utilization, depending on the terms of the plan and the employee's role. <p><strong>GitHub values</strong></p> <ul><li>Customer-obsessed</li> <li>Ship to learn</li> <li>Growth mindset</li> <li>Own the outcome</li> <li>Better together</li> <li>Diverse and inclusive</li></ul> <p><strong>Manager fundamentals</strong></p> <ul><li>Model</li> <li>Coach</li> <li>Care</li></ul> <p><strong>Leadership principles</strong></p> <ul><li>Create clarity</li> <li>Generate energy</li> <li>Deliver success</li></ul> <br><strong>Who We Are</strong><br><br>GitHub is the world’s leading AI-powered developer platform with 150 million developers and counting. We’re also home to the biggest open-source community on earth (and 99% of the world’s software has open-source code in its DNA). Many of the apps and programs you use every day are built on GitHub.<br> Our teams are dreamers, doers, and pioneers, leading the way in AI, driving humanitarian efforts around the globe, and even sending open source to Mars (and beyond!). At GitHub, our goal is to create the space you need to do your best work. We’re remote-first and offer competitive pay, generous learning and growth opportunities, and excellent benefits to support you, wherever you are—because we know that people flourish when they can work on their own terms.<br> Join us, and let’s change the world, together.<br> <br><strong>EEO Statement</strong><br><br>GitHub is made up of people from a wide variety of backgrounds and lifestyles. We embrace diversity and invite applications from people of all walks of life. We don't discriminate against employees or applicants based on gender identity or expression, sexual orientation, race, religion, age, national origin, citizenship, disability, pregnancy status, veteran status, or any other differences. Also, if you have a disability, please let us know if there's any way we can make the interview process better for you; we're happy to accommodate!"
