company,id,title,location,url,notes
cookpad,-,-,-,-,2 jobs found
fly,developer-relations-engineer,Developer Relations Engineer,North America and Europe,https://fly.io/jobs/developer-relations-engineer/,""
fly,infrastructure-engineering,Developer Relations Engineer,North America and Europe,https://fly.io/jobs/infrastructure-engineering/,""
github,2368,Staff Webhooks Platform Engineer,US Remote,https://careers-githubinc.icims.com/jobs/2368/login,"About GitHub As the global home for all developers, GitHub is the complete AI-powered developer platform to build, scale, and deliver secure software. Over 100 million people, including developers from 90 of the Fortune 100 companies, use GitHub to build amazing things together across 330+ million repositories. With all the collaborative features of GitHub, it has never been easier for individuals and teams to write faster, better code. Locations In this role you can work from Remote, United States Overview GitHub powers the software industry. Third-party integrations and many of our flagship products are driven by GitHub webhooks. Help design, build, and maintain the systems that fuel GitHub integrations. GitHub is looking for an engineer to join a team focused on building and extending our real time event platform inside of our Extenstensibility group. This team is responsible for our webhook delivery pipeline that sends hundreds of millions of HTTP requests every day. In this role, you will work among a team of remote engineers to build product enhancements to our real time APIs as well as develop new systems that make it easier for customers to act on events that take place on GitHub. We work closely with other platform teams who support our databases, queues, and the GitHub network. Our tech stack is primarily Go and Ruby. The Engineering organization is highly distributed and you will thrive in an environment of remote work and asynchronous communication. As a member of our team, you’ll always be challenged to solve interesting and novel problems that have real impact on how the world builds software. Responsibilities Lead technical decision making and architecture in the webhooks space Design, implement, and maintain scalable, reliable and performant solutions for evented architecture Maintaining and improving our event services and APIs Improving the scalability and performance of our platform Debugging problems across a large distributed system Consulting and mentoring engineers across GitHub as they implement webhooks Qualifications Required Qualifications: 6+ years architecting and building web applications 4+ years experience maintaining highly available, high volume platforms 4+ years experience building and maintaining evented architecture Bachelor’s degree or equivalent experience Preferred Qualifications: Experience with queuing and streaming systems Kafka or RabbitMQ, etc Experience with relational databases You have worked on distributed teams Strong written and verbal communication skills Compensation Range USD $118,100.00 - USD $313,300.00 /Yr. In addition, certain roles also have the opportunity to earn sales incentives based on revenue or utilization, depending on the terms of the plan and the employee's role. These pay ranges are intended to cover roles based across the United States. An individual's base pay depends on various factors including geographical location and review of experience, knowledge, skills, abilities of the applicant. At GitHub certain roles are eligible for benefits and additional rewards, including annual bonus and stock. These rewards are allocated based on individual impact in role. In addition, certain roles also have the opportunity to earn sales incentives based on revenue or utilization, depending on the terms of the plan and the employee's role. GitHub values Customer-obsessed Ship to learn Growth mindset Own the outcome Better together Diverse and inclusive Manager fundamentals Model Coach Care Leadership principles Create clarity Generate energy Deliver success Who We Are GitHub is the world’s leading AI-powered developer platform with 100 million developers and counting. We’re also home to the biggest open-source community on earth (and 99% of the world’s software has open-source code in its DNA). Many of the apps and programs you use every day are built on GitHub. Our teams are dreamers, doers, and pioneers, leading the way in AI, driving humanitarian efforts around the globe, and even sending open source to Mars (and beyond!). At GitHub, our goal is to create the space you need to do your best work. We’re remote-first and offer competitive pay, generous learning and growth opportunities, and excellent benefits to support you, wherever you are—because we know that people flourish when they can work on their own terms. Join us, and let’s change the world, together. EEO Statement GitHub is made up of people from a wide variety of backgrounds and lifestyles. We embrace diversity and invite applications from people of all walks of life. We don't discriminate against employees or applicants based on gender identity or expression, sexual orientation, race, religion, age, national origin, citizenship, disability, pregnancy status, veteran status, or any other differences. Also, if you have a disability, please let us know if there's any way we can make the interview process better for you; we're happy to accommodate!"
github,2720,"Senior Software Engineer, Authentication Team",US Remote,https://careers-githubinc.icims.com/jobs/2720/login,"About GitHub As the global home for all developers, GitHub is the complete AI-powered developer platform to build, scale, and deliver secure software. Over 100 million people, including developers from 90 of the Fortune 100 companies, use GitHub to build amazing things together across 330+ million repositories. With all the collaborative features of GitHub, it has never been easier for individuals and teams to write faster, better code. Locations In this role you can work from Remote, United States Overview GitHub is looking for a Senior Software Engineer to join the Authentication team. This team is part of Identity and Enterprise Administration (IdEA) at GitHub. We are responsible for all things authentication. We build and maintain the account login services for GitHub, protecting the integrity of user credentials, and providing means of account recovery. The ideal candidate is a team player who is comfortable working in the context of both monoliths and micro-services. They don’t shy away from hard problems, and have a strong sense of customer empathy. They are comfortable working closely with engineers at all levels as well as product managers. Responsibilities Leveraging strong OS and cryptography skills, extending existing standards that protect web-facing credentials to the OS and native app side. Work on cross-cutting projects to independently scale authentication services. Implement new and maintain existing authentication flows and management interfaces. Integrate with third party services that support authentication interfaces - Troubleshoot customer authentication issues across our product suite in an on-call rotation. Qualifications Required Qualifications 6+ years of software engineering experience 4+ years experience building high-traffic applications 4+ years experience leading a team of engineers on projects from start to finish 2+ years experience designing and building large-scale services Preferred Qualifications Experience in Go, Ruby/Rails Experience in IAM space Familiarity with 2FA/MFA, WebAuthn, SSH, PAT, Passwordless authentication concepts Familiarity with cryptography systems such as TPMs and iCloud Keychain, OAuth 2 protocols, and native app development Comfortable in delivering large ambitious projects using iterative deliverables. Strong track record of delivering projects Compensation Range USD $104,400.00 - USD $276,900.00 /Yr. In addition, certain roles also have the opportunity to earn sales incentives based on revenue or utilization, depending on the terms of the plan and the employee's role. These pay ranges are intended to cover roles based across the United States. An individual's base pay depends on various factors including geographical location and review of experience, knowledge, skills, abilities of the applicant. At GitHub certain roles are eligible for benefits and additional rewards, including annual bonus and stock. These rewards are allocated based on individual impact in role. In addition, certain roles also have the opportunity to earn sales incentives based on revenue or utilization, depending on the terms of the plan and the employee's role. GitHub values Customer-obsessed Ship to learn Growth mindset Own the outcome Better together Diverse and inclusive Manager fundamentals Model Coach Care Leadership principles Create clarity Generate energy Deliver success Who We Are GitHub is the world’s leading AI-powered developer platform with 100 million developers and counting. We’re also home to the biggest open-source community on earth (and 99% of the world’s software has open-source code in its DNA). Many of the apps and programs you use every day are built on GitHub. Our teams are dreamers, doers, and pioneers, leading the way in AI, driving humanitarian efforts around the globe, and even sending open source to Mars (and beyond!). At GitHub, our goal is to create the space you need to do your best work. We’re remote-first and offer competitive pay, generous learning and growth opportunities, and excellent benefits to support you, wherever you are—because we know that people flourish when they can work on their own terms. Join us, and let’s change the world, together. EEO Statement GitHub is made up of people from a wide variety of backgrounds and lifestyles. We embrace diversity and invite applications from people of all walks of life. We don't discriminate against employees or applicants based on gender identity or expression, sexual orientation, race, religion, age, national origin, citizenship, disability, pregnancy status, veteran status, or any other differences. Also, if you have a disability, please let us know if there's any way we can make the interview process better for you; we're happy to accommodate!"
github,2721,Staff Software Engineering Manager,US Remote,https://careers-githubinc.icims.com/jobs/2721/login,"About GitHub As the global home for all developers, GitHub is the complete AI-powered developer platform to build, scale, and deliver secure software. Over 100 million people, including developers from 90 of the Fortune 100 companies, use GitHub to build amazing things together across 330+ million repositories. With all the collaborative features of GitHub, it has never been easier for individuals and teams to write faster, better code. Locations In this role you can work from Remote, United States Overview The Enterprise Server team is responsible for the Platform and Operator Experience of GitHub’s on-premise product. We're looking for an experienced engineering manager to help lead a distributed team of Platform and Infrastructure Engineers. As a leader and manager, you will directly influence engineering culture, mentor and grow other engineers, engage in long term architectural planning, and partner closely with key partners across the company to help deliver a highly available, resilient and scalable Enterprise product. The team is highly distributed and the right candidate can thrive in an environment of asynchronous communication. We expect you to have strong written and verbal communication skills and be able to create working relationships with coworkers in locations around the globe. Responsibilities Guiding the development team’s vision, best practices, and priorities. Provide clarity and a shared understanding of decision making, direction, and progress for the team and the company. Meeting 1-1 with team members on a regular basis. Planning and supporting career development. Giving guided performance feedback. Reviewing code, design docs and leading small group discussions about engineering issues. Drive incident response and facilitate blameless postmortems. Coordinating work with engineering teams across the stack. Qualifications Required Qualifications 10+ years software engineering experience 5+ years of experience managing engineering teams Experience designing, building, scaling and maintaining distributed, highly available systems. Preferred Qualifications Passionate about creating and fostering good engineering practices and processes Passionate about resiliency and reliable infrastructure and building for high availability Strong written and verbal communication skills. Have experience managing/working on distributed teams. Experience with building or managing on-premise products. Experience with reliability engineering or experience being oncall for highly available systems Compensation Range USD $118,100.00 - USD $313,300.00 /Yr. In addition, certain roles also have the opportunity to earn sales incentives based on revenue or utilization, depending on the terms of the plan and the employee's role. These pay ranges are intended to cover roles based across the United States. An individual's base pay depends on various factors including geographical location and review of experience, knowledge, skills, abilities of the applicant. At GitHub certain roles are eligible for benefits and additional rewards, including annual bonus and stock. These rewards are allocated based on individual impact in role. In addition, certain roles also have the opportunity to earn sales incentives based on revenue or utilization, depending on the terms of the plan and the employee's role. GitHub values Customer-obsessed Ship to learn Growth mindset Own the outcome Better together Diverse and inclusive Manager fundamentals Model Coach Care Leadership principles Create clarity Generate energy Deliver success Who We Are GitHub is the world’s leading AI-powered developer platform with 100 million developers and counting. We’re also home to the biggest open-source community on earth (and 99% of the world’s software has open-source code in its DNA). Many of the apps and programs you use every day are built on GitHub. Our teams are dreamers, doers, and pioneers, leading the way in AI, driving humanitarian efforts around the globe, and even sending open source to Mars (and beyond!). At GitHub, our goal is to create the space you need to do your best work. We’re remote-first and offer competitive pay, generous learning and growth opportunities, and excellent benefits to support you, wherever you are—because we know that people flourish when they can work on their own terms. Join us, and let’s change the world, together. EEO Statement GitHub is made up of people from a wide variety of backgrounds and lifestyles. We embrace diversity and invite applications from people of all walks of life. We don't discriminate against employees or applicants based on gender identity or expression, sexual orientation, race, religion, age, national origin, citizenship, disability, pregnancy status, veteran status, or any other differences. Also, if you have a disability, please let us know if there's any way we can make the interview process better for you; we're happy to accommodate!"
github,2753,Senior Technical Business Operations Manager,US Remote,https://careers-githubinc.icims.com/jobs/2753/login,"About GitHub As the global home for all developers, GitHub is the complete AI-powered developer platform to build, scale, and deliver secure software. Over 100 million people, including developers from 90 of the Fortune 100 companies, use GitHub to build amazing things together across 330+ million repositories. With all the collaborative features of GitHub, it has never been easier for individuals and teams to write faster, better code. Locations In this role you can work from Remote, United States Overview Are you a business technologist who thrives on solving complex problems, improving organizational effectiveness, and leading through influence? Do you have a passion for GitHub, open source, and developer communities? Do you want to work closely with a senior engineering leader and help shape the future of GitHub Engineering? If so, you might be the Senior Technical Business Operations Manager (TBOM) we are looking for. As a TBOM, you will be supporting one of our Engineering Leadership Team (Eng. LT) members, managing their office, portfolio, and strategic initiatives. You will also be a boundary less collaborator, a connector of dots, and an organizational ""air traffic controller"", working across teams and functions to ensure alignment, execution, and communication. You will be a trusted advisor and confidant to the Eng. LT member, providing data-driven insights, candid feedback, and proactive support. You will also be a relationship and brand manager, building and maintaining a positive reputation for the Eng. LT member, their department, and yourself as a TBOM. To succeed in this role, you will need to have a deep understanding of both the business and the technology, as well as the ability to learn quickly, adapt to change, and operate with ambiguity. You will need to have excellent communication, coordination, and facilitation skills, as well as a strong sense of ownership, accountability, and urgency. You will need to have a growth mindset, an engineering mindset, and a customer-centric mindset. You will need to have a high degree of emotional intelligence, empathy, and integrity. You will need to have a love for GitHub, its culture, values, and mission. Responsibilities Manage the office of the Eng. LT member, including establishing, documenting, and maturing repeatable processes for critical business functions, partnering with other teams to ensure smooth operations, and preparing and delivering internal and external communications Improve department effectiveness, including serving as a gatekeeper, a pinch hitter, and a general solver of problems, improving the effectiveness of the Eng. LT member, their direct reports, and the business as a whole, and overseeing the implementation of technical or non-technical improvements Engage boundarylessly, including owning ""somebody should own this""-type projects, resolving disputes, driving consensus, and facilitating tough conversations, regardless of organizational boundaries or corporate hierarchy Manage the Eng. LT member's portfolio, including communicating, coordinating, and facilitating work in flight, especially strategic or cross-functional initiatives, reporting up and across on progress and status, and identifying, analyzing, and mitigating risks Support strategy, planning, culture, and values, including shaping the department's vision, plans, OKRs, and other strategy documents, communicating and cascading the core strategic tenants to stakeholders, and establishing, shaping, debugging, and socializing department culture, values, and health Advise and confide, including understanding the on-the-ground pulse of the department, deeply understanding issues, trends, and perspectives, and delivering persuasive recommendations, and serving as a proxy and representative for the Eng. LT member Manage relationships and brands, including furthering a ""get stuff done"" reputation, leading through persuasion and influence, and being a thoughtful and kind human leader Qualifications Required Qualifications 4+ years of experience in a technical, business, or operational role, preferably in a software or internet company Bachelor's degree in engineering, computer science, business, or a related field, or equivalent practical experience Willingness to travel up to 20% of the time. Preferred Qualifications Ability to learn new technologies, domains, and systems quickly and effectively Demonstrated ability to work with senior leaders, cross-functional teams, and external partners, and to influence and align stakeholders without formal authority Able to manage multiple projects, priorities, and deadlines in a fast-paced and dynamic environment Communicates clearly, concisely, and persuasively, both verbally and in writing, to different audiences and levels Illustrates ability to analyze data, synthesize information, and provide actionable insights and recommendations Exemplify's ability to operate with a high degree of autonomy, ownership, accountability, and urgency Exhibit's ability to embody and foster a growth mindset, an engineering mindset, and a customer-centric mindset Demonstrates practice and promote honesty, integrity, decency, fairness, and authenticity Shows passion for GitHub, open source, and developer communities Compensation Range USD $104,400.00 - USD $276,900.00 /Yr. In addition, certain roles also have the opportunity to earn sales incentives based on revenue or utilization, depending on the terms of the plan and the employee's role. These pay ranges are intended to cover roles based across the United States. An individual's base pay depends on various factors including geographical location and review of experience, knowledge, skills, abilities of the applicant. At GitHub certain roles are eligible for benefits and additional rewards, including annual bonus and stock. These rewards are allocated based on individual impact in role. In addition, certain roles also have the opportunity to earn sales incentives based on revenue or utilization, depending on the terms of the plan and the employee's role. GitHub values Customer-obsessed Ship to learn Growth mindset Own the outcome Better together Diverse and inclusive Manager fundamentals Model Coach Care Leadership principles Create clarity Generate energy Deliver success Who We Are GitHub is the world’s leading AI-powered developer platform with 100 million developers and counting. We’re also home to the biggest open-source community on earth (and 99% of the world’s software has open-source code in its DNA). Many of the apps and programs you use every day are built on GitHub. Our teams are dreamers, doers, and pioneers, leading the way in AI, driving humanitarian efforts around the globe, and even sending open source to Mars (and beyond!). At GitHub, our goal is to create the space you need to do your best work. We’re remote-first and offer competitive pay, generous learning and growth opportunities, and excellent benefits to support you, wherever you are—because we know that people flourish when they can work on their own terms. Join us, and let’s change the world, together. EEO Statement GitHub is made up of people from a wide variety of backgrounds and lifestyles. We embrace diversity and invite applications from people of all walks of life. We don't discriminate against employees or applicants based on gender identity or expression, sexual orientation, race, religion, age, national origin, citizenship, disability, pregnancy status, veteran status, or any other differences. Also, if you have a disability, please let us know if there's any way we can make the interview process better for you; we're happy to accommodate!"
